id,created_at,favorite_count,retweet_count,text
1588646717574254592,2022-11-04 21:37:47+00:00,0,1,"Budget  wins secured this year will help my district w/ public safety infrastructure needs. We all deserve to feel safe &amp; proud of where we live.

✅ $1.25 Million for King City
✅ $2 Million for Soledad 
✅ $1.5 Million for Mendota
✅ $3 Million for Merced 
✅ $250,000 Coalinga https://t.co/GWxL7Sx9Dt"
1587190153780424705,2022-10-31 21:09:55+00:00,3,0,Wishing boos and ghouls of all ages from throughout Senate District 12 a spooktacular Halloween. Be safe and enjoy! 🎃👻 https://t.co/ruymddCYWq
1585671356196061195,2022-10-27 16:34:46+00:00,1,0,"I was happy to join yesterday’s launch of Monterey County California Volunteers Youth Job Corps program. Our world is rapidly changing, so programs such as these are critical to help train and hire young adults. https://t.co/2EZjpegGXd"
1585336629085884417,2022-10-26 18:24:41+00:00,1,0,"I ❤️ spending time in #Mendota! Yesterday, I had a conversation w/ the city to discuss the vision for the community &amp; with fundining delivered, a centrally located/accessible police station &amp; city hall are in the works. Our rural communities are important &amp; worthy of investment. https://t.co/rM3oYNYz34"
1584699756470992896,2022-10-25 00:13:58+00:00,1,0,Wishing peace and light to those celebrating today! 🪔 https://t.co/ahoJ4XwfMc
1584268157690093568,2022-10-23 19:38:57+00:00,3,0,"I was proud to deliver $5 million to the @CityofMadera to repair critical wastewater infrastructure without burdening ratepayers. Residents can now rest assured that the issue is being resolved and will not impact their service or quality of life. 

 https://t.co/QYpFcPkKBm https://t.co/J8DEsdpXty"
1583537902226530304,2022-10-21 19:17:11+00:00,0,0,"Thank you, @ChancellorMunoz for the warm welcome and opening remarks that set the stage for a powerful event! https://t.co/X8FaQf5Wye"
1583522556023226368,2022-10-21 18:16:12+00:00,9,2,"Many thanks to @ucmerced Labor Center for joining me in hosting the first of its kind, Central Valley Leadership Forum. As women, we need to step into leadership roles with certainty &amp; confidence &amp; remember to lift others up as we climb. I’m already looking forward to next year! https://t.co/AZhKdK0wjv"
1582414237938307072,2022-10-18 16:52:08+00:00,0,0,Proud to secure public safety dollars benefiting residents &amp; families in my District. This funding will create educational &amp; career pathway opportunities for young people &amp; training certification/programs to ensure first responders are prepared to serve. https://t.co/xeEioNY88Q
1580658949459570689,2022-10-13 20:37:15+00:00,2,0,spent the day in #Coalinga yesterday and appreciate the opportunity to work with city staff and leadership to help address issues in the community. It was also my pleasure to support the city’s public safety efforts by securing money in this year’s budget. https://t.co/a888Nh8O89
1577872612931215360,2022-10-06 04:05:21+00:00,3,1,Our city is in mourning tonight. My heart is with the family and friends of the victims that were kidnapped in Merced this week. Offering my condolences and prayers.
1577411773363208196,2022-10-04 21:34:08+00:00,10,2,"ICYMI: Governor Newsom has signed my bill to ensure that our school children receive the highest quality foods in their school meals. My bill protects good paying jobs, invests in our farmers and puts the health of our children first! https://t.co/fhAYfZ0QtU"
1575956288160223234,2022-09-30 21:10:33+00:00,4,0,Today we celebrated and presented certificates to the graduates of the first all-female Valley Build NOW apprenticeship program. This program will help 13 women secure trades jobs throughout the central valley. I am so proud of your hard work. Congratulations! @WDB_Fresno https://t.co/zgJCvEDj58
1575251157215109121,2022-09-28 22:28:37+00:00,13,2,"#SB6 is signed &amp; delivered to the people of CA. Let’s solve our housing crisis with an expedited plan to convert empty retail space into walkable villages for residents &amp; let’s use a skilled &amp; trained workforce to do it!Everyone deserves a safe, affordable place to call home. https://t.co/u20ipxWaN7"
1574986072177590272,2022-09-28 04:55:16+00:00,88,18,"#Breaking: Starting 1/124, all CA K-12 students will eat food grown &amp; produced in the USA. This means quality food for our children, good union jobs for our workers &amp; the support for our farmers that they need &amp; deserve! Thank you, @CAgovernor for signing #SB490 #BuyAmerican https://t.co/G5kOgAQLNw"
1574852665514696704,2022-09-27 20:05:09+00:00,3,1,"@CAgovernor, @CaWomensCaucus and the women of #CalLeg have fought for the protection of women's reproductive freedom, and for legislation that supports families across our state."
1574852663321108480,2022-09-27 20:05:08+00:00,39,9,"My bill, #SB1142 jointly authored by @NancySkinnerCA establishes https://t.co/eJmZ5d3RG0, a website for the public to access abortion related info and resources in CA, was signed today! https://t.co/5dyNY54V2b"
1572341183455834113,2022-09-20 21:45:25+00:00,7,1,"On Sunday, @CAgovernor officially signed my #RCRC sponsored bill, #SB1326. My bill establishes a pathway for multi-state cannabis commerce, helping to stabilize &amp; regulate the long-term economic success of legal cannabis businesses in rural CA. 

Details: https://t.co/WjcfJEHGPZ"
1571970287209709569,2022-09-19 21:11:36+00:00,4,1,Buying locally grown food to feed our children should be a priority. We can provide healthy meals to our kids while reducing carbon emissions and stop buying food from Russia and China.  https://t.co/G0rFWzj8X0
1570479518439329793,2022-09-15 18:27:49+00:00,1,0,"I love books, libraries and librarians! Very happy to help the Dos Palos Library project with funding this year as I know firsthand what a difference a library can make in a community. https://t.co/WY3eJty9io"
1570466720175001601,2022-09-15 17:36:58+00:00,5,1,"TY to all who joined me yesterday: 

🍇Sun-Maid Growers of California 

💥 Teamsters Cannery Council and Teamsters Local 856 

🍑California Canning Peach Association 

💥Employee and Labor Relations, Pacific Coast Producers

🌽California Farmworker Foundation"
1570466715305377793,2022-09-15 17:36:57+00:00,19,5,"Yesterday, we held a press conference urging @CAgovernor to sign my bill, #SB490 Buy American Food.

My bill ensures our tax $$$ are used to feed our children quality foods at school, our workers continue to have jobs with good pay &amp; benefits &amp; that our farmers are supported! https://t.co/75CFUS3lJZ"
1569780046130479104,2022-09-13 20:08:22+00:00,6,4,"Our children, our farmers and our workers are worth the investment in domestically grown products that #SB490 ensures. Thank you, @RepGaramendi for your support of my bill, to strengthen Federal Buy American policies  at the state level. https://t.co/D9lSzAvTOv"
1569039695551819776,2022-09-11 19:06:29+00:00,3,0,"9/11 will always be remembered as a horrific day in our nation’s history. Today, I’m thinking of our first responders &amp; heroes who saved many lives. I’m also thinking of the countless others who stepped up to help however they could. Our nation will never forget your baravery. https://t.co/siNcmzdy1J"
1567586156342296577,2022-09-07 18:50:38+00:00,4,2,Madera Community Hospital provides critical medical care to a rural region in my district. Proud to have worked to secure $5 million in the state budget along with Assemblyman ⁦@FrankBigelowCA⁩ to ensure that its doors remain open. https://t.co/lPtQlwwoX0
1566830364890320898,2022-09-05 16:47:23+00:00,16,6,"Highlighting my bill on this #LaborDay, SB 490: Buy American, headed to @CAgovernor for signing. Buying domestically grown produce for our children to enjoy in school lunches, uses our tax $$$ to reflect our values. We can &amp; should support our local farmers, &amp; protect CA  jobs. https://t.co/IMxAYaPU5s"
1565732702266933249,2022-09-02 16:05:40+00:00,10,2,"$65.1 million from the #AmericanRescuePlan for the Fresno area. Only city in CA to receive $$$ &amp; the largest grant in the nation! Investsts in Ag sector modernization, climate resiliency, ensures food security, protects the environment, helps farmworkers become farm engineers."
1565727998350807040,2022-09-02 15:46:59+00:00,12,2,This year I was able to secure $15 million for The Fresno-Merced Future of Food Innovation (F3) coalition &amp; traveled to Washington D.C w/ @CentralValleyCF to ask for additional  investment. Tune in as the @WhiteHouse makes a huge announcement! https://t.co/4oXQpMtaKc
1565476063035109379,2022-09-01 23:05:53+00:00,4,2,"Experts agree: carbon capture is a critical part of reaching our climate goals. Glad to announce that #SB905 by @NancySkinnerCA &amp; I, is on its way to the Governor’s desk! CA now has an avenue for emission reduction projects while maintaining our strict environmental standards! https://t.co/ykbF0UNsRB"
1565192493339013120,2022-09-01 04:19:04+00:00,7,1,"California’s legislative session ends tonight at midnight, but the work continues. It has been the honor of a lifetime to serve the people of Senate District 12. Together, we are unstoppable! https://t.co/Nu1RFNTQ2u"
1565112251127717890,2022-08-31 23:00:13+00:00,1,0,"Top 3 conservation actions to take during a #FlexAlert.
 
🌡 Set thermostats to 78 degrees or higher

🔌 Avoid using large appliances &amp; charging electric vehicles

💡Turn off unnecessary lights

For more info or to sign up for text notifications, visit:
https://t.co/11qzpTMont https://t.co/817UjDsYCq"
1564716295156682752,2022-08-30 20:46:50+00:00,6,1,California is leading the way to create more trade opportunities for the emerging legal Cannabis market. SB 1326 will give California a competitive advantage and it’s on its way to the Governor’s desk! https://t.co/wyBbwLwkkN
1564604218111307776,2022-08-30 13:21:29+00:00,35,4,"Victory! Both #SB 6 and #AB2011 have passed the Senate and Assembly. This is a win for Californians seeking a place to call home! 

Now on to the Governor’s desk! https://t.co/vULLVxkkso"
1564395297525993473,2022-08-29 23:31:18+00:00,6,0,"I couldn’t agree more! With everyone willing to come to the table, we were able to negotiate a deal that addresses our housing crisis and cuts through the red tape.

“When a legislature operates the way it should, big things can happen.” https://t.co/jQ23C84lcW"
1563584411395715073,2022-08-27 17:49:08+00:00,1,1,"“When they wrote the Social Security laws, they weren’t thinking that young ppl w/ disabilities would ever be marriage material…didn’t think we might have dreams &amp; hopes like everybody else. We do.” #SJR8 #LorisLaw https://t.co/EVhlPWw1nx"
1562923988061339648,2022-08-25 22:04:51+00:00,5,1,TY: @toniatkinks @Rendon63rd @ilike_mike @AsmBuffyWicks @SenSusanEggman @SusanRubioCA @SenMariaEDurazo @SenGonzalez33 @SenBobHertzberg @Scott_Wiener  @SenDaveCortese @SenBenHueso @GeneralRoth @drarambulaAD31 @AsmCarrillo @AsmJimCooper @mgipson2014 @quirk_silva &amp; @AsmRobertRivas
1562923985502801921,2022-08-25 22:04:50+00:00,23,3,#SB6 &amp; #AB2011 are transformational for working families across the state. It is my belief that  both of these bills will make tremendous progress to help families have a place to call home. https://t.co/AuM1Gg0kRp
1560715229159337984,2022-08-19 19:48:01+00:00,1,0,"Sending my love and condolences to the family and friends of former First Lady of Salinas, Lisa Eisemann-Gunter. 

I have many fond memories of Lisa teaching all of my children to dance, including my sons. 

Rest In Peace, my dear friend.  https://t.co/hmeUBH0Ras"
1560346908756885505,2022-08-18 19:24:27+00:00,2,1,"Our Young Legislators program concluded in July, but many of the youth participants continue to be civically engaged and put their knowledge to work by attending city council meetings and volunteering in their communities. Keep an eye out for these rising leaders! https://t.co/mtHnbhuJBM"
1559299821160214528,2022-08-15 22:03:42+00:00,2,0,"👏🏽👏🏽 I am proud of this cycle’s accomplishments and thank my colleagues and staff for their commitment to empower, educate, and lift Californians closer to their dreams."
1559299819029442560,2022-08-15 22:03:41+00:00,1,0,"#SCR70 honors Mario Obledo &amp; his contributions to our state, designating a state building in his name. Mr. Obledo was as a Civil Rights leader, founder/leader of major Hisp.-American Orgs, a top state official, &amp; a vocal advocate. https://t.co/9xA2aChYhi"
1559299816663838720,2022-08-15 22:03:41+00:00,4,2,#SJR8 passed both houses unanimously making CA the 1st state in the nation to officially call out DAC marriage barriers as discriminatory. 💕 https://t.co/VxosS191Li
1559299814453420033,2022-08-15 22:03:40+00:00,1,0,Also on its way to the Floor is #SB1326 which will help stabilize &amp; regulate the legal cannabis industry ensuring that CA can fully capitalize on &amp; lead the national cannabis market. https://t.co/gB8WHfJ6I7
1559299812469534720,2022-08-15 22:03:40+00:00,1,0,"With the ongoing attack on 50 years of settled law, initiatives to increase protections in this area are needed now more than ever. I am proud to author #SB1142 to protect this important right. https://t.co/UtRPNyO4BY"
1559299810871545857,2022-08-15 22:03:39+00:00,0,0,"Next, #SB1109 increases the pace &amp; scale of the removal of forest waste material from both California’s burned areas &amp; ecologically stressed forests, moving  the max amount of that material as possible to a beneficial reuse facility, including ag waste.
https://t.co/XkLP7E79Sj"
1559299809114066944,2022-08-15 22:03:39+00:00,1,0,"#SB1101 is critical to fight #climatechange. Experts as the Intergovernmental Panel on Climate Change, Stanford University, Lawrence Livermore National Lab, UC Berkeley &amp; the CA ARB have identified CCUS as necessary for successful climate action globally, nationally &amp; in CA."
1559299805997780992,2022-08-15 22:03:38+00:00,1,0,"#SB532 reduces barriers to a HS diploma by amending the Ed Code. Exempts highly mobile students (military/migrant families, foster care, those experiencing homelessness, wards of the court, newcomers to the country) from local grad requirements if they can do so in a 5th yr. https://t.co/GGksnc4AfC"
1559299799467233280,2022-08-15 22:03:37+00:00,4,2,"Next out of Senate Appropriations is #SB490, which provides technical assistance for nonprofits and government agencies to purchase housing &amp; prevent displacement &amp; rising rent costs. https://t.co/TJYJyGmGAM"
1559299797651075072,2022-08-15 22:03:36+00:00,4,0,"On the affordable housing front: happy to report #SB6 the Neighborhood Homes Act is moving along. Converting commercial spaces for mixed-use development to create walkable live/work/play villages. Thinking outside of the box to tackle our housing crisis. 
https://t.co/j7AS6KRA52"
1559299794379558912,2022-08-15 22:03:36+00:00,17,3,Wrapped up last week with a bang! 🎉Proud to share that EIGHT of my bills have now passed out of the Assembly Appropriations suspense file and are on their way to the Assembly Floor. Here they are: Thread 🧵 —
1559245533004279809,2022-08-15 18:27:59+00:00,8,2,"Welcome back students, teachers and staff! Wishing you a wonderful school year! 📚🖍🚌🍎 https://t.co/zKtbGwAUXX"
1557786213469147136,2022-08-11 17:49:10+00:00,8,2,"This week, I was honored to Adjourn in Memory of my friend, Henry Huerta. Henry was a changemaker who spent his life fighting for working families.

I offer my condolences to Henry’s wife, Martha, and two children, Enrique Jr. and Zenaida.

https://t.co/3K7AcIqhUR"
1557496557179523072,2022-08-10 22:38:10+00:00,2,0,"…represented in positions of leadership across all sectors holds an immeasurable value. Justice Guerrero’s experience, veracity &amp; keen understanding of the law ensures that integrity and justice will be upheld in our beautiful Golden State.

Justice Guerrero, you make us proud!"
1557496385183707137,2022-08-10 22:37:29+00:00,22,3,"Congratulations to Justice Patricia Guerrero on her historic nomination to serve as the Supreme Court’s next Chief Justice of CA. As the daughter of Mexican immigrants and farmworkers, her nomination  reminds us that the  ability to see ourselves… https://t.co/35Be6zgljH"
1556344823103119360,2022-08-07 18:21:35+00:00,15,2,"The 2021-22 CA Budget provided $50M for Encampment Resolution Fund grants to 19 communities, including Salinas. Thank you @LCastroRamirez for visiting the city to see how those funds are being g put to use. https://t.co/aGJxtWFEM2"
1552467938942132224,2022-07-28 01:36:14+00:00,6,2,"If you or someone you know is having thoughts of suicide or experiencing a mental health or substance use crisis, 988 provides 24/7 connection to confidential support. There is Hope. Just call or text 988 or chat https://t.co/aGTJYxiiXH https://t.co/uzAs78I8rp"
1552400752848515072,2022-07-27 21:09:16+00:00,2,0,"I am happy to share my latest newsletter which highlights major wins that are in this year’s state budget and work taking place around the district. 

 Not a subscriber? Click here to sign up: https://t.co/H6iizGFbtj https://t.co/UR3Z5fA22p"
1549445093018390528,2022-07-19 17:24:32+00:00,6,1,"Proud to deliver historic investments to UC Merced &amp; UC Merced Community &amp; Labor Center. The State Budget Allocates Over $100 Million to UC Merced including $13 million to fund research, education etc. on labor issues. Read more: https://t.co/QmbAz7XovM https://t.co/s7xOGH4ehm"
1546540841258217472,2022-07-11 17:04:04+00:00,1,0,We can and must expand Clean Cars 4 All statewide without doing harm to communities that need it most. https://t.co/VJcs4eZGbI
1544414200042205185,2022-07-05 20:13:33+00:00,2,0,"SB 382 is the first of my bills for 2022 to be signed into law by Governor Newsom.
 
You can read more about SB 382 here: https://t.co/SjnfPbEr5c https://t.co/VzLX83QhyX"
1543266499535994880,2022-07-02 16:13:00+00:00,11,4,"The 2022 Young Legislators Program was a success! After a 4- week civic engagement course, students took a trip to our state Capitol. TY to staff, special guest speakers, sponsors and SD 12 students for making the 2022 YLP a success! See you next year! https://t.co/4QIsTmdHA0"
1542626102870278144,2022-06-30 21:48:18+00:00,3,1,"Homeownership for low-income families is something that I’m passionate about. Proud to have secured $350 million to support the state’s only true homeownership program, CalHome. TY Assemblymember Grayson, and the coalition of supporters for your work!

https://t.co/s2OZBc9tQH"
1542607266855022592,2022-06-30 20:33:27+00:00,1,0,"Budgets are a statement of values, and California’s budget reflects our desire to invest in our working families. I am also proud to have delivered resources for cities across my district! Read more using the link below. https://t.co/hHuxxKg2vV"
1542548808680148992,2022-06-30 16:41:09+00:00,3,0,Congratulations! 🎉 https://t.co/gAaY092Q7j
1542296397919035393,2022-06-29 23:58:10+00:00,2,0,Congratulations! https://t.co/HZzuOqebdg
1540417359105511424,2022-06-24 19:31:32+00:00,7,3,"Abortion does not go away when made illegal- this is especially true for the wealthy. The only thing overturned today by SCOTUS, was a person’s right to bodily autonomy, dignity &amp; safety in their personal medical choices. California will not stand for it.  https://t.co/bqVCSFCU6x"
1540008752962600960,2022-06-23 16:27:53+00:00,8,2,"Valleybuild NOW is launching their first all-female construction training cohort on 8/8/22. In partnership w/ the Fresno, Madera, Kings, Tulare Building Trades Council, they are offering no cost training to help women gain apprenticeships.
 
Register:  https://t.co/ryPWhYpPIS https://t.co/wqhSxyP1zJ"
1539312423605133318,2022-06-21 18:20:55+00:00,1,1,"With the Coalition for Community Investment, sponsors of SB 625, which passed with full support out of the Assembly Committee on Jobs, Economic Development, &amp; the Economy. This bill will support important work in underserved communities. 

Read more here: https://t.co/jAlPQ3QsDE https://t.co/MUomWxXIyV"
1535343722782593024,2022-06-10 19:30:43+00:00,0,0,"…or in their places of work. This pride month, let’s remember to save space for those who cannot yet be their authentic selves in public and be ready to embrace and welcome them when they can.
❤️🧡💛💚💙💜"
1535343719531966464,2022-06-10 19:30:42+00:00,1,0,"June is PRIDE month. Parades and celebrations are taking place and flags are being raised just about everywhere. But this month isn’t all rainbows &amp; glitter for many in the LGBTQIA+ community. Many are struggling because they are not accepted in their home, in their community… https://t.co/xwxIRsnGTC"
1534605479728427008,2022-06-08 18:37:12+00:00,1,0,"Without the critical work of organizations like the Madera Coalition for Community Justice, families might not have survived the pandemic and its impacts. It is my honor to be able to name them Nonprofit of the Year for Senate District 12 and to recognize their work. https://t.co/99rCnqDxZY"
1534257875735851008,2022-06-07 19:35:57+00:00,2,0,"🚨Legislative Update: This year I am working on important issues that like housing production, valley fever, &amp; climate change among others &amp; am proud of the work being done to bring relief to Californians. 

You can read more on my bill package, here ⬇️ https://t.co/QV45GLyJcJ"
1530316624028282881,2022-05-27 22:34:49+00:00,32,11,Editorial: Can California afford to be a haven for abortion? It can't afford not to be - Los Angeles Times https://t.co/Nic6HedBWj
1529506755847200768,2022-05-25 16:56:42+00:00,1,0,"If you are a high school student who is interested in learning about how government works while sharpening your leadership skills &amp; making new friends, then you don’t want to miss out! The deadline to apply is Friday, May 27, 2022 so don’t wait. Questions? Call (831) 769-8040 https://t.co/BGQXKr3IU3"
1527726119658475520,2022-05-20 19:01:05+00:00,0,0,Senator Anna Caballero’s May Newsletter | Senator Anna Caballero https://t.co/yfnGSoPEhT
1526274904886083585,2022-05-16 18:54:28+00:00,1,0,"Juan &amp; I send our condolences to the family, friends &amp; movement colleagues from the UFW &amp; SEIU of Roberto ""Bobby"" De La Cruz. Bobby was a fighter who stood up for the poor &amp; exploited, leaving behind a legacy that changed history. May he Rest In Peace.  https://t.co/pjVwfm02eh"
1526256614105227265,2022-05-16 17:41:47+00:00,3,0,"Build Skills ✔️
Help Others 🙏🏾
Earn Money 💰

If you need help paying for your education, The #CaliforniansForAll College Corps program is for you! 

For more information on this partnership with @CalVolunteers and to apply, visit https://t.co/UbvurgwHDT https://t.co/uml6jdDWfA"
1525534035476303872,2022-05-14 17:50:31+00:00,9,1,"The center is a game changer in the Central Valley providing good paying, entry level jobs with major opportunities for growth. Can’t wait to visit again. @DanielDoerschel @MikeSievert @TMobile @JoePreston01 @kingsburg_cec @CityofKingsburg"
1525534033454587904,2022-05-14 17:50:31+00:00,30,5,Wow! I was blown away by yesterday’s visit to the new T-Mobile Customer Experience Center in Kingsburg. @drarambulaAD31 and I worked hard to move the T-Mobile/Sprint merger that led to the opening of this Center in Fresno County and specifically in my district! https://t.co/W273lxqSKg
1523404925245349888,2022-05-08 20:50:12+00:00,24,1,"Happy Mother’s Day to moms of all kinds! I know that this can be a difficult day for many and for different reasons. I recently lost my own mom, and this will be the first year that I celebrate w/o her. Proud to have been her daughter! https://t.co/oA0HPEmw4q"
1523403719668207616,2022-05-08 20:45:24+00:00,6,3,¡Feliz Dia De Madres! https://t.co/A6xNIHOZbU
1522639843985006592,2022-05-06 18:10:02+00:00,15,4,Happy #SchoolLunchHeroDay! School nutrition professionals have been helping kids get the nutritious meals they need despite the challenges and uncertainties. Join us &amp; @nokidhungryca in thanking #HungerHeroes across the district &amp; state! https://t.co/Ue92ZyfpQU
1521557421390385152,2022-05-03 18:28:53+00:00,61,15,Standing with Senate President Pro Tem Atkins and my colleagues to ensure California is prepared to protect reproductive care. https://t.co/3VNzS8USnG
1521551654587273217,2022-05-03 18:05:58+00:00,7,4,Sen. Atkins and CA Leaders Hold Press Conference on CA’s Response to SCO... https://t.co/BRqc7gefKC via @YouTube
1521482749944602624,2022-05-03 13:32:10+00:00,135,12,California is prepared. That’s it. That’s the tweet.
1521250447390134273,2022-05-02 22:09:04+00:00,0,0,"Eid-ul- Fitr Mubarak to Muslims in SD 12 and around the globe! 🌙 

May this Eid fill your life with peace and prosperity. https://t.co/TNWayvPdqs"
1519473760432058368,2022-04-28 00:29:09+00:00,7,1,"Team Caballero was proud to participate in #DenimDay to raise awareness about sexual violence and debunk the myth that a person’s dress style invites sexual assault. For more information, visit: https://t.co/8FiaGERFZ3 @CaWomensCaucus  @Valor_US_ 
#PreventionWorks https://t.co/tqUxdrnbZj"
1518671812091015169,2022-04-25 19:22:30+00:00,2,1,Need help paying for school? Check out the Women in CA Leadership Foundation’s Minerva Scholarship program. For details and how to apply https://t.co/1Df1hqW9rZ #WiCLMinervaScholars https://t.co/8obiedf7S1
1515737679467491330,2022-04-17 17:03:18+00:00,8,2,"Wishing you a Happy Easter with family and friends! 🐣🐰🥚

¡Les deseo una Feliz Pascua con familiares y amigos! 🐣🐰🥚 https://t.co/BVHhLCjbkP"
1513596478811373571,2022-04-11 19:14:56+00:00,1,0,Women’s History Month 2022 Newsletter | Senator Anna Caballero https://t.co/q2hyXB58ZC
