id,created_at,favorite_count,retweet_count,text
1351217012945596418,2021-01-18 17:16:54+00:00,34,5,"It is long past time we had an AAPI in our state's highest law enforcement position. In California, we are fortunate to have some amazing candidates, including my friends @tedlieu, @RobBontaCA, and @Ash_Kalra.

@CAgovernor please do what's right. Representation matters. #API4AG"
1350873316697939968,2021-01-17 18:31:11+00:00,1,0,"@HamillHimself Well, we're not in Kansas anymore."
1350498739740262400,2021-01-16 17:42:45+00:00,55,1,"@RepLouCorrea @JoeBiden Get well soon, Congressmember!"
1350130817436065794,2021-01-15 17:20:45+00:00,20,0,"From my first hearing yesterday. While I applaud the Governor's push to reopen physical instruction, I want to make sure we're doing this thoughtfully and without creating bad incentives to open unsafely. https://t.co/eMtRLo3HFH"
1349543861450731521,2021-01-14 02:28:24+00:00,38,4,"Does she understand the difference between ""President-elect"" and ""President""?

As Eric Trump prepares to leave the political arena, I think we officially have a new contender for dumbest person in Washington, DC. https://t.co/2DrQmanjqc"
1349495419764580352,2021-01-13 23:15:55+00:00,62,12,"The peaceful transition of power by the loser after an election is at the heart of American democracy. Voting against impeachment here is an express endorsement of tyranny and a rejection of democracy.

I am sad to see my fellow OC Korean-Americans betraying our country's values. https://t.co/dwyGW55zSU"
1349187976241156099,2021-01-13 02:54:14+00:00,75,15,"America was founded on the principle that no one is above the law.

Glad to see such a strong lineup of patriotic Americans and outstanding lawyers leading the impeachment, including my friend @tedlieu &amp; fellow law school alums @Castro4Congress &amp; @jamieraskin https://t.co/phfy77HeTk"
1349113437759045633,2021-01-12 21:58:03+00:00,1,0,"@carrielaguna @KatrinaFoley @VoteCottie @JoshNewmanCA @TomUmbergCA We were just discussing this earlier today. We hope to have more information later this week, and to have a better plan going forward, with the Legislature potentially taking a more direct role in pushing for a better coordinated rollout."
1349032156773765120,2021-01-12 16:35:04+00:00,257,69,"Whether it's encouraging seditionists or refusing to wear a mask to prevent COVID spread, too many of our elected leaders are acting like spoiled, entitled brats.

Our democracy needs at least two healthy parties, which means we need some grownups in the Congressional GOP. https://t.co/E1BRS2EtN4"
1348496551593738241,2021-01-11 05:06:46+00:00,2,0,"@TPerrysburg @RayRedacted @HotlineJosh For following the law? 

Sure, Jan."
1348304117580513290,2021-01-10 16:22:06+00:00,103,43,"You can't have unity without accountability.

Lawbreakers must be prosecuted. Those who would advocate sedition and treason must be prosecuted. 

You can't have unity between arsonists and homeowners. https://t.co/pdroo6wgdM"
1348296315227099138,2021-01-10 15:51:06+00:00,68,20,"Incredible message from my former Governor @Schwarzenegger.

We are in trying times. Our democracy is under attack. But we will persevere. https://t.co/n64JpGMgz3"
1348285884823523329,2021-01-10 15:09:39+00:00,32,20,"We must also take steps to prevent this type of attack at the state or local levels.

As one local Huntington Beach resident stated after assaulting Congress, “You think if we can get into this Capitol, imagine what we could do to our local capitol.""
https://t.co/CgdAKQszTu"
1348285594875514886,2021-01-10 15:08:30+00:00,47,9,"As a former US Senate staffer, it saddens me immensely that our halls of democracy were assaulted and defiled.

Make no mistake: this was an attack on the United States of America, and everyone involved should be prosecuted as such."
1348281669548077058,2021-01-10 14:52:54+00:00,93,31,"Best case scenario- this was a *massive* failure by the Capitol Police, etc.

Worst case- as many allies believe, it was a deliberate coup attempt facilitated by insiders.

Either way, this assault on our democracy must be investigated thoroughly.
https://t.co/hG4JDHVgm5"
1348092810155577344,2021-01-10 02:22:26+00:00,1,0,@AuforGA Congratulations!
1348016186491981824,2021-01-09 21:17:58+00:00,35,1,"You know what’s divisive? Refusing to follow the letter of the law and allowing criminals to go free and clear, simply because they share your partisan views. https://t.co/C1tRm6S0Za"
1347941530254774274,2021-01-09 16:21:19+00:00,175,45,"If you're like me, you're sick and tired of OC elected leaders making news for their radical, anti-science positions.

OC deserves better. Come join me &amp; others in supporting Mayor @KatrinaFoley in her kickoff for the Board of Supervisors special election.
https://t.co/1vZE3JAug8"
1347652413528764416,2021-01-08 21:12:28+00:00,6,0,@RepMcClintock So are you coming out in support of impeachment and removal then?
1347645992737280000,2021-01-08 20:46:57+00:00,199,67,"I was so sad to see fellow Kor-Ams @YoungKimCA &amp; @RepSteel decline to validate the lawful election of Joe Biden.

Refusing to support the peaceful transfer of power is un-American &amp; wrong.

I hope they will do better to represent our values going forward.
https://t.co/bxVMmb9JDN"
1347527593705107457,2021-01-08 12:56:28+00:00,53,7,"Really proud of my friend @RepAndyKimNJ for exemplifying the true spirit of our great nation.

The seditious Trump supporters who terrorized the Capitol can wave as many US flags as they'd like. They will never be even 1/1000th as American as Andy Kim.
https://t.co/uJyOxQAlJl"
1347040576110174209,2021-01-07 04:41:14+00:00,4,0,@SenDaveMin @ReverendWarnock @ossoff Working link here: https://t.co/bIWzjcK8Zk
1346927963107848196,2021-01-06 21:13:45+00:00,25,8,This has now reached the level of domestic terrorism and should be treated accordingly. https://t.co/cGMIX7GHui
1346916404671336448,2021-01-06 20:27:50+00:00,32,7,"This is outrageous. We may have disagreements about politics, but the one thing that's always united America- until now- is our shared belief in democracy &amp; the rule of law.

Trying to overturn the will of the people through violence &amp; anarchy isn't just wrong, it's un-American. https://t.co/Qw0HJF142a"
1346681545868787712,2021-01-06 04:54:35+00:00,16,0,👀 https://t.co/TSlZ1yhv9n
1346671219056152577,2021-01-06 04:13:33+00:00,8,0,"@EricTrump First time I’ve ever seen “Eric Trump” and “work” anywhere close to each other. 

Needless to say, I don’t think anyone’s particularly scared about the prospect of the dumbest Trump trying to primary them."
1346660921209364481,2021-01-06 03:32:38+00:00,36,1,@brianefallon @CharlotteGarden Don’t forget Puerto Rico.
1346657137267601409,2021-01-06 03:17:35+00:00,91,6,"To quote my Congressmember @katieporteroc: 

Say it with me: Senate Minority Leader Mitch McConnell. https://t.co/2w4cKaXqKF"
1346648763339706369,2021-01-06 02:44:19+00:00,17,0,"@Redistrict https://t.co/77Y3G507J6

Huzzah!"
1346648344911773696,2021-01-06 02:42:39+00:00,29,0,Thank you Georgia! Thank you Stacey Abrams! https://t.co/fyFN5gAhrH
1346646315078279169,2021-01-06 02:34:35+00:00,20,0,"@Redistrict What have you seen, Dave?"
1345050411011506176,2021-01-01 16:53:02+00:00,1,0,"@taylorswift13 I think @JoshNewmanCA wore this better.
https://t.co/6CxxFpDHj6 https://t.co/Z8HJnaISuw"
1345049749318107136,2021-01-01 16:50:24+00:00,55,2,"Happy new year! Somehow, miraculously, we made it through 2020. Let's go make 2021 another year to remember, but this time in a positive way."
1342556390993272832,2020-12-25 19:42:41+00:00,1,0,"@dukeofEarlGray Thank you, you too!"
1342556348748206080,2020-12-25 19:42:31+00:00,2,0,@erininOC You too Erin! Hope 2021 brings you great things!
1342527802386436096,2020-12-25 17:49:05+00:00,105,2,"Merry Christmas from our family to yours! We hope you are having a wonderful and safe holiday. 

Good riddance to 2020, looking forward to the possibilities that 2021 will bring! https://t.co/JZNuNBkKLo"
1342311203175985153,2020-12-25 03:28:24+00:00,58,2,"As we were watching “It‘s a Wonderful Life,” Teddy just remarked, “People sure had weird hairstyles in the 90s...”

Me: “This was way before the 90s, Teddy!”

Teddy: “Ok, whatever, the 80s, dad.”"
1341771601138733057,2020-12-23 15:44:13+00:00,5,0,"@keynesianr Oh, I get it now. The clue itself is pretty tough even if solving it wasn't. ""Stands up"" = anagram of ""dustpan"""
1341769908045037568,2020-12-23 15:37:29+00:00,9,1,"Question for any crossword people out there. Did you understand the answer to the ""Stands up for dustpans, say (abbr.)"" clue in today's NYT crossword?

Never seen that clue (or heard that phrase), and I'm still confused by the answer."
1341589916761747456,2020-12-23 03:42:16+00:00,2,0,"@ChefGruel @amywiwuga We've had the pleasure of eating at UCI's Slapfish, a great addition to our community. Amy, thanks for connecting us!"
1341577763442946048,2020-12-23 02:53:58+00:00,2,0,@AuforGA https://t.co/D5ZVusjGhF
1341577551940997120,2020-12-23 02:53:08+00:00,1,0,"@freedug My kids don't like the spice, so just peppery/paprika-y, but easy to add some chili powder etc."
1341577263964323840,2020-12-23 02:51:59+00:00,1,0,"@CaliMel5 @therealweissman Not yet, but will check it out! Thx!"
1341575062885822464,2020-12-23 02:43:14+00:00,0,0,"@BornEricG Stir 1/2 cup mayo w/ 1 tsp hot sauce, 1 tbsp paprika, 1/2 tsp of garlic powder.
 
Melt 1/2 - 1 tbsp butter on a pan on medium heat, add brioche buns until golden brown.

Smear spicy mayo on bun, add pickles, tomatoes, or whatever to your taste, add chicken filet. 5/5"
1341574322717016066,2020-12-23 02:40:18+00:00,0,0,"@BornEricG Pour oil into dutch oven or other sturdy pot and fry until very hot (about 10 minutes I think?).

Meanwhile, thoroughly cover chicken breast pieces w/ dredge/breading. Put into the hot oil, cook for 4-5 minutes, then let rest on a wire rack.
4/"
1341573772025843712,2020-12-23 02:38:07+00:00,0,0,"@BornEricG (or more salt, as you'd like)
3/"
1341573593155563520,2020-12-23 02:37:24+00:00,2,0,"@BornEricG For breading, mix 1/2 cup tapioca flour, 1/2 cup rice flour, 1/2 cup corn starch (or just 1 cup flour + 1/2 cup corn starch) w/
2/3 tbsp salt
1/3 tbsp oregano
1 tbsp pepper
1 tbsp dried mustard
3 tablespoons paprika
2 tbsp garlic salt
1 tbsp ground ginger
3 tbsp white pepper

2/"
1341572923442663424,2020-12-23 02:34:44+00:00,4,0,"@BornEricG For marinade: 
Combine chicken breast, 1 cup buttermilk, 1 tsp each of paprika, garlic powder, pepper, salt in medium bowl. Marinate for 1-24 hrs.
1/"
1341571424092229633,2020-12-23 02:28:47+00:00,20,0,"Alternative tweet:

I just fried chicken. Ask me anything."
1341571139110199297,2020-12-23 02:27:39+00:00,46,2,"I just made my own version of Popeye's chicken sandwich. 

✔️ Making DEE-LICIOUS fried chicken

Now off my bucket list. https://t.co/cLWrDB7TIr"
1341560383631290369,2020-12-23 01:44:55+00:00,1,0,"@timkawakami Plus, he missed almost all of a very abbreviated preseason. Warriors clearly going to go through growing pains first half of this season, question is whether they can gel into something that looks like the Warriors of old."
1341180561394597888,2020-12-22 00:35:38+00:00,0,0,"@KevinSabellico Salty, sweet, tangy, chewy, soft, crunchy, slimy... it's umami!"
1341179581248651264,2020-12-22 00:31:44+00:00,1,0,@ssballakrishnen @PrincetonUPress Congratulations!
1341173986097446912,2020-12-22 00:09:30+00:00,2,1,@felicitynf @CarlosIran1 Congrats Carlos! What a great organization you're leading!
1340876931760156672,2020-12-21 04:29:07+00:00,1,0,@JaneKim Thank you Jane!
1340862821483962368,2020-12-21 03:33:03+00:00,280,78,"I'm glad Congress passed some COVID relief, but this is too little, too late. For the past 6 mos, @senatemajldr has prioritized fake election fraud claims &amp; unqualified judges over working families. $600 is paper-thin stimulus in the midst of a pandemic.
https://t.co/ZErt6sFQCd"
1340478229988065280,2020-12-20 02:04:49+00:00,11,1,"@jimsciutto Or following that up by cutting off a B-52 bomber, afterburners on, coming within 100 feet of the US military aircraft, in international airspace.

Again, Trump did not even acknowledge this military provocation, let alone say or do anything in response.
https://t.co/ZXG97lvxcz"
1340477612548710400,2020-12-20 02:02:22+00:00,111,17,"@jimsciutto Let's also not forget how a few months back, Russia felt emboldened enough to ram a US military vehicle in Syria, injuring active servicemembers.

Predictably, Trump had no response to what might have been seen as an act of war under normal times.
1/2
https://t.co/o0GyTE3vNd"
1340370595213529089,2020-12-19 18:57:07+00:00,11,2,"To be clear, Trump is talking about a military response to fictitious claims of voting fraud, but has said nothing public about the massive hacking of the US government. https://t.co/OexOu9tuZy"
1340369807783284737,2020-12-19 18:53:59+00:00,77,24,I'm old enough to remember when Texas Senators would actually condemn acts of war against the United States of America. https://t.co/CpzbwBf3hz
1340074528559353858,2020-12-18 23:20:39+00:00,23,4,"So sad about this news. Linda was such a tour de force that helped transform the Laguna Woods Democratic Club into a powerhouse. She was full of great cheer and joy always. 

I will miss you, my friend. https://t.co/sDeqmpw1wt"
1339585929665675274,2020-12-17 14:59:08+00:00,1,0,* can and should...
1339585867413766145,2020-12-17 14:58:53+00:00,1,0,"@DaveBrady72 Great thread, thanks for posting it!"
1339567528087961603,2020-12-17 13:46:01+00:00,8,0,"Pandamonium!
https://t.co/8J9V2CPpcZ"
1339561067895087104,2020-12-17 13:20:21+00:00,38,2,"Impt study finding social mobility in higher ed is being driven by public univs (esp. CA's UCs &amp; CSUs), w/ relatively little being done by private colleges.

Education lies at the heart of the American Dream. Proud that CA is leading the charge, but we and and should do better. https://t.co/RRPnwfTjhW"
1339047537936723968,2020-12-16 03:19:46+00:00,1,0,@kbashamilton @UDWA Congratulations Kristina!
1338173699749367809,2020-12-13 17:27:26+00:00,26,5,"While I'm not a Constitutional law expert, I'm pretty sure the 25th Amendment can be exercised between the election and inauguration.

This guy still has our nuclear codes. https://t.co/pQdOxuCZel"
1337476502368051200,2020-12-11 19:17:01+00:00,19,9,"Interested in supporting a good cause while having a Zoom meal (food and drink of your choice) with moi?

Check out this auction for @OCJusticeFund, which provides legal representation for asylum seekers and other immigrants facing deportation.
https://t.co/S97SX6ptrX"
1337055677521551364,2020-12-10 15:24:49+00:00,1,0,@AnthonyMKreis I got a free cup of coffee... 🙄
1336805071003119617,2020-12-09 22:49:00+00:00,14,2,"This is just gut-wrenching. A family was just totally destroyed by a drunk driver.
https://t.co/V0adK2hklC"
1336774519755718656,2020-12-09 20:47:36+00:00,59,17,"This shows a shocking disrespect for democracy, the rule of law, and America's most cherished values. 

These AGs should be disbarred. https://t.co/wtCAbdZk1N"
1336694396905902080,2020-12-09 15:29:13+00:00,44,2,Congratulations on being a trailblazer! https://t.co/f6StsNgXAH
1336083099218714625,2020-12-07 23:00:08+00:00,318,12,So I did a thing today. Thanks to you all for your support in getting us here. I am so excited to get to work in representing you! https://t.co/H7A5d2SBMn
1335975954544410624,2020-12-07 15:54:23+00:00,125,7,"You are invited to join me today for my virtual swearing-in ceremony, starting at 11:45am, and then help me celebrate by taking part in our ""virtual toast"" at 6:30pm (after I get back from Sac).

This was YOUR victory and I am grateful for your support. I hope to see you tonight! https://t.co/IIM17grPEK"
1334616385708683264,2020-12-03 21:51:56+00:00,12,0,"Also I have to say how truly awesome it is to: 

1) have been able to share Bill &amp; Ted with my kids earlier this year; and 

2) to be able to tell them that the actors who play these two icons are fundamentally decent and good people, much like the characters they play."
1334612159540555776,2020-12-03 21:35:09+00:00,16,1,In other words... be excellent to each other... and (then after it’s safe from COVID) party on dudes! https://t.co/ftt4WxVYvJ
1334349394020159488,2020-12-03 04:11:01+00:00,6,0,@JoseTCastaneda3 Get well soon Jose!
1333879530113486848,2020-12-01 21:03:56+00:00,24,3,"With less than a week to go until I'm sworn in, it's time to unveil my new ""official"" State Senate profile.

If you're interested in following our office's activities, please follow me at @SenDaveMin"
1333863180234231808,2020-12-01 19:58:58+00:00,145,6,"So excited to announce my first two staff hires:

Annie Chou will be my Chief of Staff. She was formerly CoS for @AsmChristySmith.

Ash Alvandi, my campaign manager, will transition over to be my District Director.

They're both awesome. Read more here:
https://t.co/Ktz5WdanH5"
1333860252865859584,2020-12-01 19:47:20+00:00,2,0,Definitely on my reading list. Looks like a fantastic contribution @shaan_haan! https://t.co/VfrkC83Ets
1333631629290475520,2020-12-01 04:38:52+00:00,3,0,@Winter I feel like Bill on a Peloton perfectly encapsulates everything that happened between the optimism of the late 1980s and where we are today.
1333591346137862144,2020-12-01 01:58:48+00:00,103,5,"In one week (Monday 12/7), I'll be sworn into the State Senate. Tune in for the livestream starting at noon, and then join us that evening for a virtual toast!

Details here: https://t.co/XgmRwtNxxe"
1333517289069580288,2020-11-30 21:04:31+00:00,0,0,"@DPOC Thanks for posting!

Important note- because of a conflict with my schedule, this has been moved to 630pm. Look forward to celebrating with folks!"
1333222527720570880,2020-11-30 01:33:15+00:00,94,23,"We're hiring! If you're interested in being a district rep, a legislative aide or executive assistant (an entry level job where you can definitely get policy experience), please submit your resume to ash@davemin.com and annie@davemin.com"
1332395664362270720,2020-11-27 18:47:35+00:00,1,0,@Jeremy_Kress My kids have made me get on my knees so I get less money. Love the stairs idea. We'll have to adopt it.
1332395355963486213,2020-11-27 18:46:22+00:00,1,0,"@Jeremy_Kress Also, Monopoly really needs to introduce securitization, collateralization, and derivatives. Tired of having no competition other than the ""banker"" to mortgage my properties to."
1332394623637942272,2020-11-27 18:43:27+00:00,1,0,@Jeremy_Kress You need a helicopter.
1332349480796971008,2020-11-27 15:44:04+00:00,44,5,"The upcoming GA special election isn’t just about Georgia, it’s about whether the US Senate will provide relief for small businesses and workers who have been slammed by the COVID-19 pandemic.

If Mitch McConnell remains Majority Leader, there will be no  aid for California."
1332347179407613954,2020-11-27 15:34:56+00:00,16,2,"Beautiful, compassionate, intellectual and thoughtful essay by Pope Francis on finding and keeping our humanity during COVID-19. Worth a read.
https://t.co/KAEVn6p9WS"
1332142778181029889,2020-11-27 02:02:42+00:00,1,0,@AlMuntges @HoffProf 1 hr 46 minutes. But it's broken up into different segments so they probably just aired one part.
1331961280664543232,2020-11-26 14:01:30+00:00,23,0,"Happy Thanksgiving to everyone! We're thankful for all of our blessings, even during this year of COVID-19, and we're praying for those who are struggling through these difficult times.

May you all have a bounty of food and love today. https://t.co/G2vCJ6yPA6"
1331631372486676480,2020-11-25 16:10:34+00:00,54,13,"This is incredible.

We have a Trump lawyer (best known for making dishonest arguments to delegitimize our elections) purporting to represent truth by using a quote she's attributing to Teddy Roosevelt, being called out by TR's direct descendant for lying.

Wheels within wheels. https://t.co/cOK5uBAZ1g"
1331335193240641537,2020-11-24 20:33:39+00:00,1,0,@LANow “I was saying BOOO-VINE...”
1330982685477531648,2020-11-23 21:12:55+00:00,68,6,"Amidst all the madness of 2020 &amp; also the historic nature of Kamala Harris as VP, it's easy to overlook the fact that Janet Yellen will the first female Treasury Secretary.

I for one am looking forward to the return of smart, thoughtful economic policy."
1330958805778059269,2020-11-23 19:38:01+00:00,37,4,"Front page of today's @ocregister on the challenges newly elected officials face as we transition into our new jobs.

But don't worry. We're building a great team that will be laser focused on serving the residents of #SD37. I can't wait to get started. 
https://t.co/Oe4KXsw0IH https://t.co/IjQ9fBZMO5"
1330934977777700865,2020-11-23 18:03:20+00:00,3,0,"@kpwhiteboard @chellestrow This is an oldie but a goodie.
https://t.co/dF1IFkjfsm"
1330697888070975491,2020-11-23 02:21:14+00:00,62,3,"This probably goes without saying, but Ted Cruz sucks. https://t.co/ccKSJrhlcc"
1330541144946728961,2020-11-22 15:58:23+00:00,47,0,"Just another Saturday night... making kimchi!

Thanks to the Korea Kimchi Festival USA for inviting me to participate last night. 

Kimchi is an essential part of Korean cuisine &amp; has huge health benefits.

It's basically cole slaw but more cultured. https://t.co/HCCb6xPtEK"
1330311429983879168,2020-11-22 00:45:35+00:00,47,4,"I was privileged to join staff &amp; volunteers at @SecondHarvestFB as we assembled some 7000 Thanksgiving boxes for struggling families.

I'm thankful for organizations stepping up during this time of need.

To help out, you can learn more here: https://t.co/mUrnGc1BPL https://t.co/aCwG5HUljC"
1329899464710975489,2020-11-20 21:28:35+00:00,17,3,"This is what’s wrong with America and Trump-ism today. When it comes to the integrity of the vote and our democratic system, there is only one side- doing what’s right, counting every vote fairly, and then seating the winners. https://t.co/uJOAOtNcw4"
1329873757989572609,2020-11-20 19:46:26+00:00,39,9,"Today is #TransDayofRemembrance, when we remember those who were murdered by anti-trans violence. 

37 trans people were killed this year alone. That is unacceptable.

Trans rights are human rights and we must work to ensure they are protected. #TDoR2020"
1329639711451746310,2020-11-20 04:16:25+00:00,23,4,"This is obviously appropriate and right, but it is sad that we have come to this moment. https://t.co/CTSa4UNx7v"
1329553384374865921,2020-11-19 22:33:23+00:00,1,0,@markc54 Thanks... long day
1329553023492734976,2020-11-19 22:31:57+00:00,14,1,"Important announcement for #SD37 residents: since Orange County is in the purple tier, we are subject to the Governor’s new limited Stay At Home Order, which bars non-essential work and gatherings from 10pm-5am, beginning this Saturday night. https://t.co/vX5NVpA2Lp"
1329502501456863235,2020-11-19 19:11:11+00:00,1,0,@valkenburgh No quartering. https://t.co/8AKSBfKZh4
1329494228536156160,2020-11-19 18:38:19+00:00,43,3,"@AJDelgado13 Sorry, I know you were making a point here, but all I could see was Rudy wiping his nose and then using the same hankie to wipe his head and face."
1329454736194547714,2020-11-19 16:01:23+00:00,2,0,@JRBxv You're stirring up way too much trouble James. Let's thigh up the loose ends here and call it a day.
1329428046894354432,2020-11-19 14:15:20+00:00,1,0,"@marcorubio Dude what happened to you? You used to have some measure of self-respect.
https://t.co/uivs4z3HMb"
1329427679838310400,2020-11-19 14:13:53+00:00,46,4,"I'm old enough to remember when a bunch of people called Al Gore a sore loser because he had the gall to request  Florida be allowed to finish its counting of votes.

Those same people are now all conspicuously silent about Donald Trump."
1329274505106132993,2020-11-19 04:05:13+00:00,4,0,@NatashaAxelrod You are very sophisticated and have a deep sense of humor.
1329245975349579776,2020-11-19 02:11:51+00:00,3,0,"@JRBxv Honestly, I'm just winging it."
1329230350879387648,2020-11-19 01:09:46+00:00,3,0,@LOLOCGOP Oh man that was salty.
1329228313512927235,2020-11-19 01:01:40+00:00,40,0,Very upset this tweet only has 16 likes. Making me rethink the goodness of the human race. https://t.co/l2GYJJPCkU
1329217449456123904,2020-11-19 00:18:30+00:00,21,0,"Also, to be clear, this class was taught via Zoom and not in person. 🤣🤣🤣"
1329202818180255746,2020-11-18 23:20:21+00:00,108,1,"To be clear, as a member-elect (and someone who signed the #NoBigOil pledge), I was not invited to the Maui junket. 

But as my. students can tell you, I just taught my last Contracts law class of the semester in my bedroom, which is definitely nowhere near Hawaii. #ImNotInMaui"
1329167383596912640,2020-11-18 20:59:33+00:00,22,0,"Thank you, thank you, I'll show myself out.

Don't forget to tip your servers."
1329166955526246400,2020-11-18 20:57:51+00:00,61,2,"Because 🦃 day is next week, I've got ""jokes"":

Why does DST always end before Thanksgiving? 
- The extra thyme makes everything taste better.

Why do CEOs buy up beef broth, chicken broth, &amp; vegetable broth for Thanksgiving?
- They're trying to maximize their stock options."
1329150608603979777,2020-11-18 19:52:54+00:00,1,0,@GilpinPeri Thank you Peri!
1329148241707896832,2020-11-18 19:43:29+00:00,13,12,"Please consider joining me in helping to flip Georgia's two US Senate seats.

The economic stakes could not be higher.

If these seats remain in Republican hands, there will likely be NO FEDERAL RELIEF for small businesses &amp; workers affected by COVID. 
https://t.co/OaYWHkA4UL"
1329104169794355202,2020-11-18 16:48:22+00:00,20,0,"ALSO THIS MEANS MORE STUFFING FOR ME!!!

GOBBLE GOBBLE!"
