id,created_at,favorite_count,retweet_count,text
1303907352525979649,2020-09-10 04:05:12+00:00,1,0,"@DaveDBCD Gin, Cointreau, lemon juice, soda water. i like my gin forward so I’d say like 3 parts gin, 1 part Cointreau, 1-2 parts lemon juice and soda water depending on how stiff you like it. Super refreshing drink."
1303906837658398721,2020-09-10 04:03:10+00:00,1,0,@cbadnik @MomsDemand @ca_brady @shannonrwatts Thank you!
1303356663412391936,2020-09-08 15:36:58+00:00,1,1,"Come join us tonight at 5:30pm on Facebook Live for a town hall we're doing on public education (K-12) during the time of COVID-19 and beyond.

Fortunate to have @PaulBokota and Teri Sorey join us for this very important conversation. Come join us!
https://t.co/QhS1KRaKuv"
1303055351411957760,2020-09-07 19:39:40+00:00,5,1,@SierraClub @SierraClubCA @clcv
1303055223284408321,2020-09-07 19:39:09+00:00,24,6,"We've literally never experienced a heat wave here like the one we just had. 

We're facing a climate crisis &amp; we must respond accordingly. That starts by voting out climate change deniers like my opponent @SenatorMoorlach.
https://t.co/fLD4g5dY7E"
1303028696278642688,2020-09-07 17:53:44+00:00,1,0,@kpwhiteboard 😊
1303027750387642368,2020-09-07 17:49:59+00:00,11,2,"Happy Labor Day! Working Americans are at the heart of our country's exceptionalism.

At a time when the stock market and unemployment rate are perversely both at historical highs, we must do better to ensure our economic system rewards hard work and the contributions of labor. https://t.co/GexzsVQzA4"
1302787568371601409,2020-09-07 01:55:35+00:00,44,2,"Hope you all are enjoying your weekend! We're trying to stay cool w/ our inflatable backyard pool, a refreshing gin cocktail, and Korean BBQ chicken on the grill!

Thank you to those who struggled to give us Labor Day, the weekend, and a pathway to the middle class. #LaborDay2020 https://t.co/MEdEy4xCq3"
1302708788592402432,2020-09-06 20:42:33+00:00,8,0,Stay off the drugs. https://t.co/Rxoh261x1E
1302670764039045120,2020-09-06 18:11:27+00:00,19,3,Funny how the election fraud all comes from the people who profess to be most concerned about it. https://t.co/2AwAHVzjG2
1302634422743646208,2020-09-06 15:47:02+00:00,7,2,"Apparently, this will be an evergreen tweet up until January 20, 2021. https://t.co/TdMWkxx66I"
1302424812187336706,2020-09-06 01:54:07+00:00,2,0,@ca_resistance @HB_Huddle @RepHarley @DanKalmick @VoteCottie @oscarhbcali @nataliemoser Thank you!
1302309746372870146,2020-09-05 18:16:53+00:00,8,0,"For someone who plays golf as much as he does, Trump has a terrible swing. Maybe those old bone spurs are acting up?

Also, our country is reeling from the COVID-19 pandemic, and we’re facing a myriad of domestic &amp; foreign threats. Not a great time to be golfing, POTUS. https://t.co/V2Wh37xzZW"
1302305964243087364,2020-09-05 18:01:52+00:00,4,1,"Someone is lying here- either the guy who won’t turn over his tax returns, won’t comply w/ subpoenas, has told the most lies in Presidential history, and has already been caught lying on this matter w/r/t his comments on McCain... 

or

the entire media, including Fox News.

🧐 https://t.co/0rLteCI2ip"
1302265147432398852,2020-09-05 15:19:40+00:00,651,95,"I can honestly say this was the first F grade I’ve ever received in my entire life.

And I’m damn proud of it.

#EndGunViolence #EnoughIsEnough #Gunsense

@MomsDemand @ca_brady @shannonrwatts https://t.co/tAJ16D22Ze"
1302250227038973958,2020-09-05 14:20:23+00:00,1,0,@rick_zbur So sorry for your loss Rick.
1302059781130051584,2020-09-05 01:43:37+00:00,2,0,@narvette @katieporteroc Thanks Katie!
1302059707486498817,2020-09-05 01:43:20+00:00,4,1,"My opponent @SenatorMoorlach continues to dismiss the serious risks of COVID-19, both in his policymaking and in his personal life. 

Read my response here:
https://t.co/60raCDnTso https://t.co/ruOEA7WZoF"
1301964911103193088,2020-09-04 19:26:38+00:00,5,0,"@jaycaspiankang Irvine, dude. Also, Fullerton. Come over to the other side of the Orange Curtain."
1301751554412740608,2020-09-04 05:18:50+00:00,29,6,"It is literally more likely than not that any given statement from Trump is a lie. Yes, he has called McCain a loser, many times. https://t.co/36EcAyTUDH"
1301683289669775360,2020-09-04 00:47:35+00:00,4,1,"This would help explain why Trump doesn't seem to care even a little bit about the lives of our active military, or have any desire to stand up to Putin following reports of Russian bounties on our soldiers in Afghanistan. https://t.co/wb0WzB59CI"
1301645124682706945,2020-09-03 22:15:55+00:00,4,0,So excited about this. https://t.co/PVhfZqmhsF
1301615155910852609,2020-09-03 20:16:50+00:00,7,0,"Apparently, @VP has forgotten the Ninth Commandment: ""Thou shalt not bear false witness against thy neighbor.""

Also, the sheer gall of appearing in front of a banner that says ""LifeWins!"" while you're pushing a ""herd immunity""  policy that would kill millions is next-level. https://t.co/6Pls87Uf53"
1301612964693172225,2020-09-03 20:08:08+00:00,10,8,"So it's probably safe to say, unless he publicly states the contrary, that Sen. Moorlach supports ""herd immunity."" 

If you see him (admittedly unlikely, unless you're a big donor or Big Oil exec), ask him how he's comfortable w/ a policy that will kill millions of Americans."
1301612195889856512,2020-09-03 20:05:04+00:00,16,10,"Sen. Moorlach is also an anti-vaxxer and climate change denier who is seen as one of the most anti-science politicians in the country. Don't just take my word for it, read what his former Chief of Staff has to say:
https://t.co/DDTSiWqJWW"
1301611612952879104,2020-09-03 20:02:45+00:00,6,3,"Also worth noting that Moorlach came out in strong support of the recent Huntington Beach ""Liberate"" protests, has frequently made light of COVID, &amp; was the first state politician to hold in-person fundraisers. 
https://t.co/08EnqB7HS7"
1301610148960464896,2020-09-03 19:56:56+00:00,11,8,"Also, if you're wondering where my opponent @SenatorMoorlach stands on ""herd immunity,"" so am I. 

Given that he has never once publicly criticized Trump or his policies (and has frequently praised Trump), I think it's safe to assume Moorlach = Trump until otherwise stated."
1301607001143664641,2020-09-03 19:44:26+00:00,45,25,"The Trump administration's ""herd immunity"" approach is insanity and would lead to the deaths of MILLIONS of Americans.

You cannot claim to be pro-life and condone this approach.
https://t.co/cY14SvYvrU"
1301601268494790656,2020-09-03 19:21:39+00:00,2,0,@HB_Huddle @DanKalmick @nataliemoser @oscarhbcali @VoteCottie @HarleyRouda @Diedre4Assembly @JoeBiden @KamalaHarris Thank you!
1301230653095067648,2020-09-02 18:48:58+00:00,10,1,"If you're not outraged by Trump's tax cuts, you're not paying attention.

And of course, working families in CA are taking an even worse hit. We're a massive donor state AND the end of our SALT deductions has given many families huge increases in our tax bills. https://t.co/EN33QQPr7g"
1300918757204795392,2020-09-01 22:09:36+00:00,6,9,"The rise in anti-AAPI hate crimes is alarming.

We must stand together against hate of all kinds directed at all groups- Muslims, Latinos, LGBTQ+, African Americans, AAPIs, etc.

We outnumber the white nationalists. If we come together, we will prevail.
https://t.co/27IFZCdswc"
1300869968523739136,2020-09-01 18:55:44+00:00,11,1,I'm old enough to remember when the United States government would condemn this type of tyranny and stand with the people of other countries yearning for fair and free democratic rule. https://t.co/6uWlZRJQRT
1300828597234483200,2020-09-01 16:11:20+00:00,20,9,"My opponent @SenatorMoorlach has now voted 100% this term against gun violence prevention, including yesterday's vote on SB 914, which would have prevented the Poway massacre.

Moorlach cares more about his NRA 'A' rating than our community's safety.
https://t.co/rMOb0YtlGi"
1300495254689210368,2020-08-31 18:06:45+00:00,6,2,@ddale8 ❄️
1300492096122417152,2020-08-31 17:54:12+00:00,40,16,"Yes, we can do better but CA is the 5th largest economy, had a $22B surplus last year &amp; is actually trying to promote economic, social &amp; racial justice as well as fair &amp; free elections.

Trump's lickspittles want to attack our state? 

Bring it on.
https://t.co/BvsNk82nHu"
1300119379875512322,2020-08-30 17:13:09+00:00,6,1,"We have totally botched our COVID-19 response &amp; as a result we're facing a massive economic downturn. The policies we enact over the coming months will be critical.

A good first step would be for @senatemajldr to enact the HEROES Act. Americans need help.
https://t.co/MFbHqnx5z9"
1300115343608696833,2020-08-30 16:57:07+00:00,22,18,"Another major confrontation here. Russia seems to be intent on pushing the boundaries right now, likely because they know our POTUS is in their pocket.

Frightening times.
https://t.co/YZAl56GHa5"
1300109644245790721,2020-08-30 16:34:28+00:00,2,0,@mbarmbarmbar LOL. Clearly I need my coffee!
1300095018011484167,2020-08-30 15:36:21+00:00,17,4,"It’s Saturday and the United States is facing a series of unprecedented crises related to public health, jobs, small businesses, wildfires, racial justice, foreign policy, etc. ... which means that Trump will be playing golf at one of his courses, again, at taxpayer expense."
1299897254195548161,2020-08-30 02:30:30+00:00,16,6,"Wow. The projected death toll if every American gets this— not to mention the massive toll on our economy if this is our official stance and every other country in the world quarantines us— is unthinkable.

This is not policy, it’s the willful destruction of America. https://t.co/v47IZqqx6O"
1299895751271542784,2020-08-30 02:24:32+00:00,43,8,"Maybe if you‘d worn a mask at your GOP luncheon or taken advantage of the free COVID-19 test CA Legislators were encouraged to take, you wouldn’t be seen as a high COVID risk.

But let’s make this a partisan issue rather than an issue of personal (ir)responsibility, https://t.co/dk7bA1bPlo"
1299884380245041152,2020-08-30 01:39:21+00:00,50,23,"If this had happened while Obama was President, this would have been covered 24-7 by CNN/ NYT/ Washington Post/ etc. and Fox News and the right-wing media would be calling for immediate impeachment.

Under Trump, this doesn’t even merit coverage. https://t.co/uwy87dGxVo"
1299827854750834688,2020-08-29 21:54:44+00:00,17,8,"Well, I'm proud to be endorsed by @ca_brady &amp; a @MomsDemand Gunsense Candidate. 

Unlike my opponent, I won't be a toady for the NRA and I promise I will continue to turn down any and all contributions from the gun lobby.

Enough is enough. 4/4 https://t.co/QE2reg9WPG"
1299826946604322816,2020-08-29 21:51:08+00:00,13,6,"Both bills are clearly permissible under the Second Amendment &amp; would help to reduce gun violence and crime. So why is Moorlach opposed?

Maybe it has something to do with his 'A' rating from the @NRA and the huge amounts of gun lobby money he receives? 3/
https://t.co/BOJjlMSfQN"
1299825915648643072,2020-08-29 21:47:02+00:00,11,4,"The second bill, AB 2847, would require semiautomatic pistols to have ""microstamps"" so that guns, particularly those used in crimes, can be better traced. 2/

https://t.co/hEAJyFTU1X"
1299825617576189952,2020-08-29 21:45:51+00:00,22,14,"This week, my opponent @SenatorMoorlach voted against two important gun violence bills that would help to reduce the problem of unlicensed and untraceable firearms in our communities.

The first, AB2362, would penalize gun dealers who break the law. 1/

https://t.co/QVvYZlEasl"
1299815547421351937,2020-08-29 21:05:50+00:00,3,1,https://t.co/VGEMzGdth7
1299708800782401536,2020-08-29 14:01:40+00:00,6,0,"Go @HBoushey! (and also Stephen Malkmus!)

Great profile here.
https://t.co/ArVr41LYgW"
1299361616085970945,2020-08-28 15:02:04+00:00,9,5,"Just to be clear, these groups are celebrating the murder of innocent people, simply because the murderer shares their political views and the victims disagree.

This is Trump's base and all the American flags in the world don't hide the fact they're nuts and they hate America. https://t.co/HVISNwI4yk"
1298995935473627139,2020-08-27 14:48:59+00:00,20,2,"Jared, the poster boy of privilege, making a strong case here that he, not Eric or Junior or Ivanka or Tiffany, is the dumbest member of the Trump Family. https://t.co/mSgp8p9q7s"
1298822307100520448,2020-08-27 03:19:03+00:00,7,2,"With everything that is going on, I wanted to make sure to highlight this very important day #WomensEqualityDay2020  #WomensEquality https://t.co/ZNvyjjPuPk"
1298752582664380424,2020-08-26 22:42:00+00:00,13,8,"Praying for the health and safety of our State Legislators and their staffs, including my political opponent @SenatorMoorlach and my neighbors @TomUmbergCA @LTwoC @VoteCottie @choi4assembly @QuirkSilva65th.

This is no joke, people. Be smart and cautious.
https://t.co/02TUkhPJP1"
1298654602997321728,2020-08-26 16:12:39+00:00,11,3,Thank you to @HB_Huddle for an awesome candidate rally and food drive this past weekend. Was great to see fellow candidates from #TeamHuntingtonBeach including @nataliemoser @oscarhbcali @DanKalmick! https://t.co/6AGX1vSyHx
1298633064965222400,2020-08-26 14:47:04+00:00,0,0,@GHDebats @GavinNewsom Thank you! Let’s do this!
1298407069301661696,2020-08-25 23:49:03+00:00,3,0,@AmaniZara @shelieaston @soOCforPete @OCforPete2020 Thanks for having me! Sorry to keep taking up your space :) Look forward to seeing you again tomorrow!
1298338960138100736,2020-08-25 19:18:24+00:00,33,9,"Excited to announce the endorsement of Governor @GavinNewsom, who has demonstrated extraordinary leadership during these trying times. I look forward to working w/ him to help steer California through the challenges ahead of us.

Read the release here: https://t.co/w2ziid5GGp https://t.co/GKIXFBVTjX"
1298335212942680065,2020-08-25 19:03:31+00:00,3,0,"Also, if you're so confident that ""we the people"" want to vote for a Republican Party that is today almost entirely captured by a Trumpian anti-science (as is well represented by your ""Know Nothing"" tweet), why are you all working so hard to suppress the vote?"
1298334661085556736,2020-08-25 19:01:19+00:00,3,0,"No one is forcing you to listen to experts, @govkristinoem. 

But most of us want elected officials who will heed the advice of experts and adopt data-driven policies. Not because they're elites, but because it's nice to have a government that knows what the hell it's doing. https://t.co/55oH6VUkfH"
1298262112431517699,2020-08-25 14:13:02+00:00,8,5,"At this point, it’s beyond negligent for universities to be reopening campuses as usual. https://t.co/xfz2HOJrBF"
1297970896720678912,2020-08-24 18:55:51+00:00,13,2,"Absolutely right. Either DeJoy is so exceptionally incompetent that he's the only Postmaster in history presiding over massive USPS delays, or he is doing this on purpose.

Either way, impeachment and removal and further consequences are appropriate.
https://t.co/dmFxiz99yf"
1297951149174054912,2020-08-24 17:37:23+00:00,0,0,@adamshersh And Goya.
1297948111537463297,2020-08-24 17:25:19+00:00,27,1,"Wait, is this #RNC2020 convention just going to be four days of Trump ranting? 

Wow."
1297408584641175552,2020-08-23 05:41:25+00:00,8,0,"Well, the #RNCConvention lineup is certainly going to be a lot easier to remember than “Person Woman Man Camera TV.”

“Trump, Trump, Trump, Trump, Trump, Trump.” https://t.co/1dGDizDA45"
1297374582123270145,2020-08-23 03:26:19+00:00,11,2,Beautiful. Make America decent again. https://t.co/io2ftq4Iwa
1297373664619278336,2020-08-23 03:22:40+00:00,22,4,A+ tweet. https://t.co/e95qlpZrFd
1297373357847875584,2020-08-23 03:21:27+00:00,14,1,@RJSzczerba ”I’ll have a Blue Wave as a chaser.”
1296869898136641536,2020-08-21 18:00:53+00:00,4,0,"Patriots, regardless of political party, oppose Trump. #CountryOverParty https://t.co/mObudgWWMa"
1296836200439791620,2020-08-21 15:46:58+00:00,12,6,"The gaslighting here is on another level. Our mail is delayed by 2+ weeks but there’s nothing to see here, and this certainly has nothing to do with Trump’s proclamations that the USPS needs to be slowed down to prevent voting by mail. https://t.co/KaxWoltv0d"
1296804292817371136,2020-08-21 13:40:11+00:00,7,0,"I'm looking forward to next week, when my comparisons will be Diamond &amp; Silk, the gun toting St. Louis couple, the DC prep school brat, Trump, Junior, Eric, Ivanka, and whatever other F list cranks the @GOP manages to get to speak. 

Going to be a LOT easier!
2/2"
1296803297047674880,2020-08-21 13:36:14+00:00,5,0,"We had a number of campaign events this week, and it was a lot of pressure, knowing that the people I was presenting to would all later be watching the brilliant oratory of Bernie, Michelle, Bill, Gavin, Barack, Kamala, Joe, etc.!

BUT...

1/"
1296666570085695491,2020-08-21 04:32:55+00:00,27,11,"It’s not about universal mail voting, and it’s not about voter fraud. Trump is trying to undermine the most fundamental element of any democracy- the right to vote. https://t.co/VdVFtv09vf"
1296557396374859776,2020-08-20 21:19:06+00:00,13,11,"This is absolutely infuriating. They are intentionally crippling the Post Office, most likely to screw with mail ballots, but it's having a massive negative impact on people and small businesses who depend on the mail.
https://t.co/dNXNQroZOE"
1296535925632012288,2020-08-20 19:53:47+00:00,1,0,"In hindsight, it seems more and more likely that the “Bloody Sock” was a fraud.
https://t.co/LfgZbcphnG"
1296525562719002624,2020-08-20 19:12:37+00:00,15,4,"School's back! Our kids are so excited to see their friends, even if they can’t be together in person.

Thanks to our teachers &amp; school administrators for making this happen. It‘s clear they put a tremendous amount of work into curriculum, technology, &amp; other logistics. https://t.co/a3iCPozEAT"
1296515628673544193,2020-08-20 18:33:08+00:00,1,0,"Either way, I guess Mexico will most definitely NOT be paying for the wall."
1296505766342307841,2020-08-20 17:53:57+00:00,27,9,Lying to Congress is a crime. I expect that @katieporteroc and her colleagues will remind DeJoy of this on Monday. https://t.co/BYJCkPZEVt
1296491654547935232,2020-08-20 16:57:52+00:00,13,0,"Has anyone considered the possibility that Trump's nickname for Steve Bannon might just be ""Mexico""?"
1296470736270491651,2020-08-20 15:34:45+00:00,1,0,@LagunaBeachDems Excited to work with your amazing club to flip this seat. Let's go @LagunaBeachDems @DPOC!
1296470498537242624,2020-08-20 15:33:48+00:00,0,0,@RebeccaViscont1 @LagunaBeachDems Thanks Becky!
1296470210044735488,2020-08-20 15:32:39+00:00,2,1,"Climate change is accelerating, and California wildfires are going to be a mainstay of our summers.

Thank you to our firefighters for their heroism in battling these fires. Stay safe out there.
https://t.co/4UhVbTC8BY"
1296468391625195520,2020-08-20 15:25:26+00:00,8,0,Really inspiring speeches last night. Excited to make history and to elect our country's first AAPI to the White House! Go Kamala!
1296082059333496832,2020-08-19 13:50:17+00:00,32,21,"Simply astounding that the Senate GOP KNEW ALL OF THIS during the impeachment and removal proceedings AND STILL VOTED TO ACQUIT.

Despicable and un-American. They all need to go.
https://t.co/liH5sk1nLs"
1295770084657389571,2020-08-18 17:10:37+00:00,21,1,"As the new school year begins, let's remember to be patient w/ our teachers, who are dealing w/ new teaching challenges &amp; the same COVID-19 stresses we all face.

And look at the bright side: no need for new school clothes (or at least, only the top half 🤣)."
1295760648995876864,2020-08-18 16:33:07+00:00,16,6,"ICYMI: Our race has been rated ""Lean Democratic""!

We're facing some steep headwind w/ COVID-19 and efforts to undermine the US Postal Service. But with your help, we can win this race!

Consider volunteering or donating today:

https://t.co/UaISJD2MIi

https://t.co/3qo7WDFiP0 https://t.co/zAh2fODtYr"
1295577876385812482,2020-08-18 04:26:51+00:00,35,11,"As we mark the 100th anniversary of women’s suffrage, let’s remember the struggles our forebears endured so we all could have this basic right.

And think about how hard Trump and his cronies are working to disenfranchise us.

They know how important our votes are."
1295574758231343105,2020-08-18 04:14:27+00:00,2,0,@LOLOCGOP PEDs for sure.
1295574656997404675,2020-08-18 04:14:03+00:00,3,0,"@LOLOCGOP True, but somehow Eric always ends up on top.

https://t.co/3tIjiDwbsH"
1295573191759298562,2020-08-18 04:08:14+00:00,29,5,Still the dumbest Trump. https://t.co/7qQ0rSrVc4
1295397616277057537,2020-08-17 16:30:33+00:00,8,2,"""Senator @SenatorMoorlach is a climate change denier with one of the worst environmental voting records in the entire California Senate."" 

Don't just take my word for it. See his voting record here:
https://t.co/fLD4g5dY7E"
1295394469789888512,2020-08-17 16:18:03+00:00,7,1,"We are in the midst of a climate crisis. Temperature records will keep being broken as climate change accelerates.

A reminder my opponent @SenatorMoorlach is a climate change denier w/ an F rating from the Sierra Club.

We need elected leaders who follow science over ideology. https://t.co/e6vVMrfdl3"
1295012611549880321,2020-08-16 15:00:41+00:00,5,1,Woke up to these headlines. No bueno. #BadNewsSunday https://t.co/DaCJELFDWq
1294994550969122817,2020-08-16 13:48:55+00:00,7,2,Yesterday marked the 72nd anniversary of the date when Korea achieved independence. Happy #KoreanIndependenceDay to all the Korean-Americans (including myself and my kids) living in #SD37 and beyond! https://t.co/5vbXJUzN6p
1294372872366903296,2020-08-14 20:38:35+00:00,9,3,"Just finished reading this incredible piece on climate change.

It's so important that we recognize the profound climate crisis we are facing. Its impacts will be far greater than COVID-19 (and already are in parts of the world, as this piece describes).
https://t.co/N7V5TNkC6V"
1294107090730901506,2020-08-14 03:02:28+00:00,10,4,Outrageous. Anti-democratic. Tyrannical. https://t.co/q5d1bPaWQC
1294033696777895936,2020-08-13 22:10:49+00:00,11,0,"@AndrewYang Congrats! Not sure why you weren't on the original slate, but I'm glad you'll be there. Important voice speaking to important issues."
1293996599077507072,2020-08-13 19:43:25+00:00,3,0,🍿🍿🍿😲😲😲 https://t.co/tdY57PLjoZ
1293947166067572737,2020-08-13 16:26:59+00:00,7,2,"Trump is trying to destroy fair and free elections in this country.

I never thought this could happen here. 

But too many feckless Trump supporters (including my opponent @SenatorMoorlach) have enabled Trump by lauding him and refusing to ever call him out. https://t.co/syFnBrKtCN"
1293943650385195011,2020-08-13 16:13:01+00:00,1,0,"#ProtectThePostalService
https://t.co/RXvqaYa3QB"
1293939625556205568,2020-08-13 15:57:01+00:00,6,2,"With classes starting next week, a number of my students have still not received their textbooks due to mail delays.

Trump‘s attacks on the Postal Service are anti-democratic. They will also have huge negative ramifications on our society and our economy.
https://t.co/QuLCqTc7pu"
1293659001427603456,2020-08-12 21:21:55+00:00,12,4,"COVID-19 did not ""just disappear,"" it is not cured by using hydroxychloroquine, and the number of deaths has nothing to do with the number of tests we are administering (or not).

This has been the worst failure of the federal government in my lifetime. https://t.co/8QunBUmd7e"
1293575021227433984,2020-08-12 15:48:13+00:00,17,6,"This is the most important story right now. Massive hijinks happening with our US Postal Service. 

This is already negatively impacting people and businesses, and if Trump’s appointee keeps this up, it will mean complete havoc for our November 3 election.
#ProtectUSPS https://t.co/Fg2l6ZNylY"
1293285362559721472,2020-08-11 20:37:13+00:00,18,6,Huge news for the AAPI community (and everyone else). https://t.co/i4RlmFmZHM
1293283320483069952,2020-08-11 20:29:06+00:00,73,23,Honored to have the support of our next Vice President @KamalaHarris and can't wait to see her on the campaign trail again. https://t.co/kaPNm45XC1
1293275167322382336,2020-08-11 19:56:42+00:00,10,3,"Hopefully, these ""small technical changes"" will include making them compatible with Article I of the Constitution. https://t.co/NJbQOVLvM1"
1293273110674718720,2020-08-11 19:48:32+00:00,13,4,"Uh, big difference between COVID-19 and Normandy. Sending more people to the front lines of WWII meant we were more likely to win. Sending more people to the front lines of our current pandemic means we're more likely to lose.

Thanks for playing, Lou. https://t.co/NT98XmcVSk"
1293207897464135682,2020-08-11 15:29:24+00:00,35,12,"The dog whistles get louder as Trump’s poll numbers keep dropping.

Yes, he’s a racist.  But let’s stay focused. In 83 days, we can reject his toxic brand of white nationalism &amp; incompetence by voting him and all his lackeys out.

Register, volunteer, donate, vote. https://t.co/AKTzf3ZdLC"
1292978592565964800,2020-08-11 00:18:13+00:00,2,0,@AngelaM_SLP Fresh air.
1292922980134088705,2020-08-10 20:37:14+00:00,3,0,@dandrezner Quantum Leap
1292921847953022977,2020-08-10 20:32:44+00:00,704,292,"California is the 5th largest economy &amp; had a $22 billion surplus last year. 

You want to talk about mismanagement, Mitch? Maybe you should look at your home state, which receives $148 billion more than it paid in federal taxes, while NY, NJ &amp; CA are all massive donor states. https://t.co/seVKwsgp91"
1292663188991782913,2020-08-10 03:24:55+00:00,6,0,@baseballot This is so unbelievably politically nerdy. Love it.
