id,created_at,favorite_count,retweet_count,text
1588568637761552385,2022-11-04 16:27:32+00:00,7,4,"Another 261,000 new jobs created with more associated wage increases."
1588565271748694016,2022-11-04 16:14:09+00:00,19,6,"Let's not forget how terrible the economy was when @potus took office.

Yes, we've had tough challenges, but we're on the right track, including on inflation (where we're outperforming every other country).

Economy ⬆️
Unemployment ⬇️
Wages ⬆️

VOTE BLUE!
https://t.co/n9QeL77pCw"
1588527421820899329,2022-11-04 13:43:45+00:00,2,1,Absolutely horrific. Terrific (if sobering) reporting by @AP. https://t.co/3Do2SSeCUr
1588393364323389440,2022-11-04 04:51:03+00:00,16,1,Excited that our kids got to see @JoeBiden and @MikeLevin tonight! https://t.co/1CA5bHcmLb
1588355378127204352,2022-11-04 02:20:07+00:00,99,10,Waiting for @MikeLevin and @JoeBiden in Oceanside! https://t.co/SAkrx4UpAa
1588354512942616576,2022-11-04 02:16:40+00:00,3,0,@cbadnik @MikeLevin @POTUS @GavinNewsom @MomsDemand Here!
1588156249819951107,2022-11-03 13:08:51+00:00,1,0,"@DarthPutinKGB Wow. This ""parody account"" is 1) really not a parody account; 2) really really not funny; and 3) really really really consistently wrong, about everything."
1588149141330219010,2022-11-03 12:40:36+00:00,3,0,"Been a while since I got a 2-and-out!

Wordle 502 2/6*

🟩🟨⬜⬜🟨
🟩🟩🟩🟩🟩"
1588148657785696258,2022-11-03 12:38:41+00:00,4,0,"OF COURSE the ""fentanyl in your Halloween candy"" scare, first proposed in a GOP political ad, then spread at every opportunity by FoxNews, was a hoax.

I know of many families who kept their kids from trick-or-treating bc of this partisan nonsense. 😡😡😡
https://t.co/iHFYdFjo3x"
1587905981203107840,2022-11-02 20:34:22+00:00,0,0,@emily_hughes3 Thank you!
1587872140279574528,2022-11-02 18:19:54+00:00,3,0,But it's a value killer for Twitter imo. And probably something he and his Saudi/Russian investors should have vetted before grossly overpaying for this company. 6/
1587871985069002752,2022-11-02 18:19:17+00:00,4,0,"Given that the new owner of Twitter is a guy who equates the @nytimes with a random fake news website, it's easy to see why he doesn't understand the idea of verification and ""trusted"" sources. 5/"
1587871891372417024,2022-11-02 18:18:54+00:00,4,0,"For those of us who use this site to read breaking news, hot takes, etc., we will become inundated with fake ☑️ accounts (which of the 2000 new @StephenKing accounts should I trust?), which will lead us to disengage and move to other platforms. 4/"
1587871829904879616,2022-11-02 18:18:40+00:00,6,0,"Making the ☑️ button ""pay to play"" will eliminate its actual value, both for people with the ☑️ button and those who follow them. 3/"
1587871688703627264,2022-11-02 18:18:06+00:00,2,0,"Most of us on Twitter (including many with the ☑️) primarily use this site to read the content posted by others (esp. ☑️ accounts).

The ☑️ button allows us to easily discern between those who are who they say they are and the vast hordes of bots, trolls, and randos on here. 2/"
1587871493630722049,2022-11-02 18:17:19+00:00,14,2,"My 2c on @elonmusk's ☑️ proposal:

Elon clearly thinks the primary benefits of ☑️ are for the verified user.

As someone who has ☑️ but not a million followers, I think he's wrong. The primary benefits of ☑️ are for the average Twitter user, to discern who's real vs. fake. 1/"
1587849009535668224,2022-11-02 16:47:59+00:00,0,0,Very interesting thread about one key figure in the climate denial movement. https://t.co/iYvBGN459f
1587769966983491584,2022-11-02 11:33:54+00:00,21,14,"According to the @OCRegistrar, with one week to go, only 13.53% of ballots have been returned.

In 2018's Blue Wave, Orange County had a 71% turnout.

Do better, OC! VOTE! https://t.co/QpjdxIhD7f"
1587620902157488128,2022-11-02 01:41:34+00:00,8,0,This is the only correct take. https://t.co/gMmeifdEDO
1587572764776464391,2022-11-01 22:30:17+00:00,1,0,@socalbyrd Thank you! I’m privileged to represent you!
1587568600382070793,2022-11-01 22:13:44+00:00,84,34,"We’re one week away from polls closing. The stakes are enormous. 

Democracy, women’s rights, climate, a sustainable economy, and so much more are on the ballot.

The biggest weapon we have is voter turnout. 

High turnout = 🌊🌊🌊
Low turnout = 💩💩💩

It’s that simple. VOTE!"
1587524682533650433,2022-11-01 19:19:13+00:00,192,94,"Don't tell me that launching a massive social experiment (legalizing all gun carry) based on a radical untested theory (more guns reduces gun violence) which was proffered by gun lobbyists and defies common sense is ""conservative.""
https://t.co/NBXDtfJUdt"
1587455300918878209,2022-11-01 14:43:31+00:00,47,15,"Of course he did.

I've said this before, and I'll say it again:

THIS IS A LAWLESS SUPREME COURT.

It does not respect the rule of law, it does not care about fairness or objectivity, it cares only about advancing extreme right-wing and partisan Republican interests. https://t.co/cUlLT9lVgh"
1587450132827471872,2022-11-01 14:22:59+00:00,9,0,@MollyJongFast https://t.co/1yqHoBkMaO
1587449795907506177,2022-11-01 14:21:39+00:00,7,0,Is Brian Kemp seriously trying to tell us people should vote for Herschel Walker because he has some master plan to address inflation and gas prices? GTFO
1587448612572647427,2022-11-01 14:16:57+00:00,6,0,"Here's why Herschel Walker's transgressions are so egregious.

As with other MAGA Republicans, we know HW is totally unqualified to actually govern. All these guys have are moral outrage issues to campaign on. 

So when they completely fail on that front, what do they have left? https://t.co/Mw50Qxfr2I"
1587439463902326784,2022-11-01 13:40:36+00:00,4,0,"Pretty good, but what's up with the pro-Assembly bias here? No Senate coverage!"
1587436479143215110,2022-11-01 13:28:44+00:00,5,2,"Excited to start this 86-clue crossword puzzle (and trying to finish it in under 15 minutes) from @FromBenC and @jeremiak of @CalMatters!

https://t.co/ctmnk7T4sF"
1587310163580440576,2022-11-01 05:06:48+00:00,1,0,"@JenniferFearing I was a little off, but to be fair, I live in Irvine!"
1587285775330091008,2022-11-01 03:29:53+00:00,3,0,"@JenniferFearing I will tell you how that experiment ends... you get to drink a glass of wine without being bothered, and your candy will disappear within 20 minutes."
1587154243823104000,2022-10-31 18:47:14+00:00,91,24,"So the obvious question is ""how?""

How will you lower gas prices, reduce inflation, and restore economic opportunity?

Because every chance you've had, your answer has been to cut taxes for the top 0.1% and undermine Social Security and Medicare.

And that's not working. https://t.co/Gva0ZMxL4Z"
1587153312020717568,2022-10-31 18:43:32+00:00,1,0,"@timkawakami Wiseman still looks raw, but he's progressed a ton since his first season, and the physical tools are tremendous. Between his wingspan, quickness, and vertical, he takes up so much space in the paint.

It's easy to imagine what a huge difference maker he could be for this team."
1587084410632953857,2022-10-31 14:09:44+00:00,32,2,"California has perhaps the most secure and transparent elections in the country. 

Meanwhile, local election officials here and across the country fear for their safety because of the bogus claims you and your party are making with ZERO evidence.

Stop destroying our democracy. https://t.co/0INu3S24JR"
1587082790834556929,2022-10-31 14:03:18+00:00,27,4,"Maybe I'm missing something, but it seems to me the defining brand of Trumpism is just to be the biggest a$$hole possible. https://t.co/fZ6jrY6yL3"
1587055832465743872,2022-10-31 12:16:11+00:00,44,13,"Let me be clear. The racist attacks on Jay Chen are anti-Asian hate, and I unequivocally condemn them and call on those responsible to retract them immediately.”
6/6"
1587055775779733504,2022-10-31 12:15:57+00:00,32,7,"... these despicable campaign ads, which falsely slander Lt. Commander Chen—and by implication every other Chinese-American—as a Communist Chinese sympathizer, will further stoke the flames of anti-Asian hate and result in more violence against Asian Americans.
5/"
1587055680975839237,2022-10-31 12:15:35+00:00,28,8,"... a decorated officer in the U.S. Naval Reserves of Taiwanese descent who is running to represent Orange County’s 45th Congressional District. At a time when Asian American leaders are fighting to protect our AAPI communities from anti-Asian hate...
4/"
1587055563979882497,2022-10-31 12:15:07+00:00,31,9,"... following former President Trump’s “China Virus” rhetoric blaming COVID-19 on Asian American communities.

That is why it is so disheartening to hear of the vile, racist smear campaign against my friend Jay Chen...
3/"
1587055436435378177,2022-10-31 12:14:36+00:00,28,8,"“As one of only two Asian Americans—and the only Korean-American—in the California State Senate, I have heard from too many Asian Americans in Orange County and across the state who have experienced racially-motivated harassment, assault or even worse...
2/"
1587055281405513729,2022-10-31 12:13:59+00:00,206,86,"My statement on the despicable racist ads that Republicans are running against my friend @jfchen, a Taiwanese-American officer in the Naval Reserves who is running to represent north OC in Congress. #StopAsianHate #StopRacism 
1/ https://t.co/5wVMqLQfGK"
1586879701036900352,2022-10-31 00:36:18+00:00,34,3,"Proud to support #MicheleBell for OC Superior Court judge!

She's currently an OC Superior Court Commissioner and is endorsed by a wide array of diverse and bipartisan figures, including Sheriff Don Barnes, 50 sitting Superior Court judges and myself.

Vote for Michele! https://t.co/U0ReHEPzM0"
1586875465578385408,2022-10-31 00:19:28+00:00,6,1,Good thing the new CEO of Twitter decided to jump the gun and post fake conspiracy theories from a random website to try to debunk the idea this was a politically motivated attack. https://t.co/dHGuwlWVom
1586766739425009665,2022-10-30 17:07:26+00:00,10,0,"I will also state that the $44 billion price for Twitter as a purely economic investment is outrageously high, but is pretty damn cheap if we’re talking about potentially swinging the next few elections and destroying American democracy in the process."
1586762912953081858,2022-10-30 16:52:13+00:00,14,0,"The new owner of Twitter is apparently one of those people who rejects facts reported by the ""mainstream media"" in favor of innuendo posted on outlets I've never heard of. https://t.co/sfaO8Efuc7"
1586313605087043584,2022-10-29 11:06:50+00:00,19,1,"1) I'm not even sure that was a ball.

2) There is nothing more morally satisfying than watching cheaters get caught.

#AnyoneButTheAstros https://t.co/vrq6lCAIKF"
1586176204893143042,2022-10-29 02:00:51+00:00,52,0,"@TrentTelenko This is a ridiculously terrible take. This was clearly a politically motivated attack, just like January 6 (which you've never acknowledged publicly as far as I've seen) was.

And as we know, attacks like these are part of the toolkit of authoritarians, from Hitler to Putin to..."
1586175371568812033,2022-10-29 01:57:32+00:00,14,2,"This is so horrible. I hope Paul recovers from his physical injuries, and that both he and Nancy recover from their emotional trauma.

The threats of violence against politicians, which we saw at the fore on January 6, are threats against our democracy. https://t.co/4WjHAEdsvG"
1586173646816485376,2022-10-29 01:50:41+00:00,28,12,"The rise in anti-Semitism and other hate in this country is alarming. ""It can't happen here"" until it does. https://t.co/8gvzHrYEST"
1585638267356971009,2022-10-27 14:23:17+00:00,1,0,"Donald Trump must be so proud of his protege.

https://t.co/UHeqrcGjMk https://t.co/aFC44oNoMq"
1585636366695571457,2022-10-27 14:15:44+00:00,9,0,"In CA alone, we're expecting $54 billion in funds for transportation, water, cybersecurity, etc.

To quote @POTUS, this is a big f-ing deal!

So how come no one is giving the Biden administration credit for what is clearly very astute and forward thinking economic policy? 
2/2"
1585635960498188290,2022-10-27 14:14:07+00:00,6,0,"So here's the thing I don't understand. Traditionally, we've looked to fight recessions by passing stimulus packages.

Well, we've got massive stimulus that will be allocated in the coming months thanks to the Bipartisan Infrastructure Act and Inflation Reduction Act. 1/2 https://t.co/OvqeSXZyZt"
1584966618995888128,2022-10-25 17:54:23+00:00,9,2,"Let's be clear. California faces big challenges and we need to do more to improve the climate for small businesses.

That being said, predictions of gloom and doom for our economy continue to be proven wrong.

Eat your hearts out, Texas, Florida, &amp; Mississippi. #CaliforniaDreamin https://t.co/d6En4FgJ3W"
1584639143002673152,2022-10-24 20:13:07+00:00,33,6,"I spent yesterday in NorCal canvassing for @AAPILegCaucus priority candidate @saraminzadeh, running to be the first Iranian-American woman in the #CALeg.

She's smart, thoughtful, and a champion for climate and women's rights. She's going to be an incredible legislator! https://t.co/cBKY4zHXhL"
1584211541582544896,2022-10-23 15:53:59+00:00,33,8,"I see these ridiculous ads by GOP candidates claiming they will ""lower gas prices"" or ""reduce inflation"" without actually explaining how they will do this.

We're facing global inflationary pressures, and the US is doing a much better job in addressing these than other countries. https://t.co/lgdxZAdNOv"
1583835322135085056,2022-10-22 14:59:01+00:00,3,0,The mainstreaming of white nationalism and fascism in this country is very very frightening. https://t.co/oHstRz2tjh
1583830644680847361,2022-10-22 14:40:26+00:00,2,0,"@wandafmm83 Agree with this, but IF the choice is between voting for every office and initiative OR turning in your ballot, the most important thing is to turn in your ballot."
1583820341297655808,2022-10-22 13:59:29+00:00,19,2,"Have you voted yet? Here in CA, we make it easy! Drop your ballot in the mail or at a voting center or ballot box (https://t.co/giFtZxfK0a).

Also, you don't have to vote on every race (although down-ballot candidates would appreciate if you did!). Get your ballot in before 11/8! https://t.co/7rXFhFFLC5"
1583541380931952640,2022-10-21 19:31:00+00:00,7,0,It seems more and more likely that Trump committed treason. https://t.co/nqYvTvKVKk
1583481643456614400,2022-10-21 15:33:38+00:00,1,0,@AuforGA @AmerAcadPeds @MAG1849 @ASAGrassroots @docsinpolitics @314action @ASALifeline @GAHouseDems @GASenateDems @GeorgiaDemocrat @fultondems @GSAHQ Congratulations!
1583466035130224640,2022-10-21 14:31:36+00:00,4,0,"There were serious issues discussed, but ngl, the tour part of this was pretty dang fun. Incredible history at UMG, which includes iconic record labels like Geffen and Interscope as well as @taylorswift13's label Republic Records. Yes, my daughter is a Swiftie. https://t.co/lmtPS0RCTt"
1583465235259613185,2022-10-21 14:28:26+00:00,93,11,Very upset about the news I am reading about my home city of Irvine during this political cycle.
1583464597914152960,2022-10-21 14:25:54+00:00,3,0,"Wow, huge trade for the @49ers. If the rest of their roster can get healthy, and if Jimmy G can get over his chronic yips in clutch situations, the Niners might just be the favorites to win the whole thing."
1583279031507513344,2022-10-21 02:08:31+00:00,34,8,Excited to be here at the Newport Beach Women’s Democratic Club for their 2022 Democratic Candidate Forum! Huge turnout and so much excitement. Let’s go get this! https://t.co/JOc0cm38Ah
1582917850347413504,2022-10-20 02:13:19+00:00,17,0,Thanks Paxton!
1582916345414311937,2022-10-20 02:07:20+00:00,10,0,bfjkdmnbjfmnbmnm fdn
1582908470050713600,2022-10-20 01:36:02+00:00,10,1,"Say it with me...

This is what democracy looks like! https://t.co/UzuKcYlzH2"
1582908276928233472,2022-10-20 01:35:16+00:00,7,0,"Join me tomorrow night at @NBWDC alongside these amazing candidates as we work to get them elected! #TheFutureIsFemale

@kimcarr4ca @fionama @katieporteroc @judiemancuso @KatrinaFoley https://t.co/RGAEMm1UGp"
1582447204899299330,2022-10-18 19:03:08+00:00,0,0,@Devin30382814 @JoJoFromJerz @CNN Trump charged taxpayers for Secret Service agents staying at Mar-a-Lago and his other properties. It was unprecedented and extremely expensive for taxpayers. But you already know this.
1582407298336423937,2022-10-18 16:24:34+00:00,10,3,"Social Security, Medicare, and our solvency as a nation are on the ballot. https://t.co/zwB8Y5u6cw"
1582405268989542404,2022-10-18 16:16:30+00:00,40,15,"🚨🚨🚨 

I am hearing from many campaigns and political insiders that WE WILL LOSE THE HOUSE AND SENATE UNLESS VOTING TURNOUT PICKS UP SUBSTANTIALLY.

Democracy, women's rights, LGBT rights, the climate crisis, Ukraine, and so much more are on the ballot.

VOTE VOTE VOTE!"
1582381950370664448,2022-10-18 14:43:50+00:00,106,8,"@JoJoFromJerz .@CNN let me know when President Biden starts charging taxpayers for his Secret Service detail to stay at his home. Otherwise, this is a pretty dumb “story” at a time when there’s a lot of really important news to report on."
1582099766485229569,2022-10-17 20:02:32+00:00,12,1,"Reading between the lines, it sounds like Herschel Walker paid for an abortion to end the first pregnancy, and then didn't pay child support after the second pregnancy.

And somehow, in the era of Donald Trump, this is the candidate evangelical Christians are touting. #FalseIdols https://t.co/nBFhvE7OoG"
1582057884753354752,2022-10-17 17:16:07+00:00,12,1,"Went up to Bakersfield yesterday to help my colleague @MHurtadoCA get reelected! Huge turnout and great energy. Thank you @casendems for a tremendous job of organizing!

Knocked on 60 doors, talked with 25 people and even persuaded a few folks!

Let's go get this! #ValleyStrong https://t.co/b4Xj2amsts"
1582042133820715008,2022-10-17 16:13:32+00:00,2,0,Thread about why I ended up supporting the tax rebates the Legislature is sending out rather than a gas tax suspension. https://t.co/efeLPfW1xw
1581827754667831296,2022-10-17 02:01:40+00:00,2,0,"I was so excited to spend Thursday evening in support of Hari Lal, who's running to represent Anaheim Hills in the Anaheim City Council. 

Hari is a successful immigrant who embodies the American Dream, and has given back to his community for decades.

Let's get Hari elected! https://t.co/SYHIEkGv5e"
1580595936945852416,2022-10-13 16:26:52+00:00,8,0,"Wow. I was 46 years old when I realized that Alex Jones is only 2 years older than me.

Chronic lying is apparently not good for your health. https://t.co/sAZwvSZwHb"
1580595236312449032,2022-10-13 16:24:05+00:00,1,0,@prmaria @Davemin Thanks!
1580587962672111617,2022-10-13 15:55:10+00:00,24,4,"But I'll be voting against most of the other ballot measures (even ones I agree with!), because I believe these are matters that are best determined by the state legislators you elected to represent your interests, after they closely and carefully review the issues at play. 12/12"
1580587598799511552,2022-10-13 15:53:44+00:00,28,4,"So I'll be voting for Proposition 1, because I think it's important that we establish state constitutional protections against federal attacks on reproductive rights following the Supreme Court's decision in Dobbs... 11/"
1580587331701993472,2022-10-13 15:52:40+00:00,16,4,"But I would urge you to think about when and where you want to limit our discretion. 

In general, unless you both agree with the policy AND also believe it's necessary to tie the hands of future legislatures, I'd recommend voting against the referenda and initiatives. 10/"
1580587049693822976,2022-10-13 15:51:33+00:00,15,2,"There are certainly instances in which limiting the flexibility of the Legislature might be considered appropriate or even necessary. For example, many people, myself included, believe limiting the Legislature's ability to raise taxes is an important constraint here in CA. 9/"
1580586787000315905,2022-10-13 15:50:30+00:00,15,3,"For example, imagine a cause you care deeply about. Let's say there's a ballot initiative that proposes to spend $10 billion a year for that.

That may sound great, but forces hard tradeoffs. Where do we cut $10b? Public safety? Education? Health care? 8/"
1580586319696183296,2022-10-13 15:48:39+00:00,17,2,"Once enacted, these propositions tie the Legislature's hands, in ways that are both intended (by the supporting interest groups) and unintended.  7/"
1580586129631301632,2022-10-13 15:47:53+00:00,18,3,"These are decisions that should be thoughtful, and the result of careful, close analysis of the tradeoffs involved. But we have work, families, social lives... most of us don't have the time or energy to engage in this type of effort. 6/"
1580585740253044736,2022-10-13 15:46:20+00:00,22,4,"We as voters are expected to make momentous decisions that might be worth billions of dollars to certain groups or industries, based on a short blurb in our voter guide and of course the political ads funded by interest groups. 5/"
1580585289159827456,2022-10-13 15:44:33+00:00,24,3,"Often, these ballot propositions are proposed by well funded interest groups who couldn't convince a majority of the legislature to support their cause. They spend tens or even hundreds of millions of dollars on political advertising that is often very misleading. 4/"
1580585073937563649,2022-10-13 15:43:42+00:00,22,4,"Initiatives and referenda bypass the Legislature and once passed, become immovable obstacles we cannot change and which can only be amended or repealed by the voters, an incredibly difficult task given the size of our state's voting population. 3/"
1580584853145206787,2022-10-13 15:42:49+00:00,26,3,"New proposed laws often have hidden agendas or nuances that are difficult to understand, even with a seasoned staff and close analysis of the issues. As a new(ish) legislator, I can tell you even ""simple"" bills often have complex issues not obvious on first read. 2/"
1580584478669316096,2022-10-13 15:41:20+00:00,79,19,"I'm not making ballot recommendations this year, but I did want to share my thoughts on ballot initiatives and referenda here in CA. 

I think you should vote NO unless you strongly support the policy AND you believe it's necessary to bypass the legislature. 1/"
1580565992970674177,2022-10-13 14:27:52+00:00,7,3,"Here are my unsolicited cold takes (opposite of hot takes?) this morning.

1) Even after losing last night, the Dodgers are favored to win the NLDS.

2) Very few people care what Tulsi Gabbard thinks.

3) The elections are the most impt way we can all impact our own future. VOTE."
1579983205964185600,2022-10-11 23:52:05+00:00,35,7,"I was proud to lead a #YesOn1 event yesterday in Koreatown. This amendment would restore Roe v. Wade in our state constitution. At a time when women's rights are being trampled around the world, CA must lead. 

I'm proud to be a coauthor of Prop 1, and urge you  to vote #YesOn1! https://t.co/ZzjNVh8kcj"
1579869202449432581,2022-10-11 16:19:05+00:00,1,0,"It would make this tweet make a lot more sense.
https://t.co/B51Id0AfP0"
1579869084035842055,2022-10-11 16:18:36+00:00,3,0,I'm now waiting for the news to drop that Kanye was also speaking with Putin before his lunatic anti-Semitic tweets. https://t.co/uYe6HcLgIk
1579497085405396994,2022-10-10 15:40:25+00:00,16,0,"This tweet is only 4 days old, and it has already aged incredibly badly. https://t.co/B51Id0jcN0"
1579182660978900994,2022-10-09 18:51:00+00:00,9,0,Heroic bravery by the people of Iran. #MahsaAmini https://t.co/TFrnstGYrk
1578489301221793792,2022-10-07 20:55:50+00:00,7,1,Person. Woman. Man. Camera. TV. https://t.co/B51Id0AfP0
1578177283122028545,2022-10-07 00:16:00+00:00,17,1,"Proud to be named as a Reproductive Freedom Champion by @prochoiceca with an A+ grade. 

I will continue to fight to protect women's reproductive rights and health.
https://t.co/ssGVHMrqKt https://t.co/jVxMO7lSsE"
1578057019596087299,2022-10-06 16:18:07+00:00,8,0,"This is a crazy system that encourages massive waste and is totally counterproductive at a time when the entire western US is facing drought due to the effects of climate change. 

Glad to see our state is taking action, but we need a serious federal and regional overhaul. 5/5"
1578056501112864780,2022-10-06 16:16:03+00:00,2,0,"This is apparently pretty common. Water districts, esp. those in drought-prone areas, need to ensure adequate supply so they buy up water rights.

But when they have sufficient water supply, they don't want to lose these rights, so they are forced to use their excess water. 4/"
1578056023838818309,2022-10-06 16:14:09+00:00,2,0,"I spoke with one local water district that had invested heavily in alfalfa growing operations. When I asked why alfalfa, the answer was that it was particularly water intense so they could use their excess water to grow it. 3/"
1578055927906725889,2022-10-06 16:13:46+00:00,3,1,"We have a complex patchwork of different laws, but collectively, these tend to encourage overuse through so-called ""use it or lose it"" provisions. 2/
https://t.co/z5265XSK7j"
1578055057756389376,2022-10-06 16:10:19+00:00,8,1,"Since joining the CA Legislature, one of the things I've had to try to get up to speed on has been water policy.

One clear conclusion is that we need a major overhaul of state and federal water rights, which is complicated and politically fraught. 1/
https://t.co/MfXY52a22O"
1578030915875262465,2022-10-06 14:34:23+00:00,12,0,"Occasionally, Elon Musk will veer wildly out of his lane, leading to catastrophic results.

Sounds familiar... https://t.co/ChVsF6UXVt"
1577462979167068160,2022-10-05 00:57:36+00:00,0,0,@luckyadam https://t.co/pn6whcMHBw
