id,created_at,favorite_count,retweet_count,text
1588622943030235136,2022-11-04 20:03:19+00:00,0,0,"Thank you @CalOptima for the informative tour of your @CalPACE_org center. Through this program, Orange County seniors are able to benefit from an impressive array of preventive, primary, acute, and long-term care services while staying in their community. https://t.co/pnwwcEcwsv"
1588308173101801473,2022-11-03 23:12:32+00:00,0,0,"(2/2) This model has proven effective in significantly reducing recidivism rates and offers a clear path forward toward rehabilitation for those who have been incarcerated. I hope to see this innovative program expanded throughout California.

Learn more: https://t.co/s90FiyIwjJ"
1588308091996545024,2022-11-03 23:12:13+00:00,6,2,"(1/2) I enjoyed learning more about @pitzercollege's Justice Education Initiative, CA's first in-prison bachelor's degree program. Using an Inside-Out model, Pitzer students &amp; incarcerated men are able to earn their bachelor's degrees side by side. https://t.co/pIeyfNJd9R"
1587916446239059968,2022-11-02 21:15:57+00:00,0,0,"As Laurie's neighbor, I witnessed Laurie's commitment to service a few weeks ago when I encountered 2 abandoned German shepherds &amp; she went out of her way to assist me in wrangling the dogs.
These two sweet dogs are healthy &amp; ready to be adopted at @OCAnimalCare 📞(714) 935-6848 https://t.co/vAE2DSuZuz"
1587916250604195841,2022-11-02 21:15:10+00:00,3,1,"I was pleased to congratulate Laurie Stoops as our ""Citizen of the Month"" for October. Through her exemplary volunteerism w/ special needs athletics &amp; her tireless work as an OC probation officer, Laurie has played an important role as a leader, advocate &amp; role model in SD29. https://t.co/bFVgZL3me7"
1587514579893907456,2022-11-01 18:39:05+00:00,2,0,"For October, I recognized Corazon Taste of Mexico as our Restaurant of the Month 🌮

W/ live music, a unique selection of custom craft beers &amp; imported wines from Mexico, Fernando Romero serves authentic Mexican staples with daring new twists.

📍120 S Brea Blvd #106 @cityofbrea https://t.co/pyzq7SHDiR"
1587213995114606592,2022-10-31 22:44:40+00:00,19,0,Happy #Halloween from my family to yours! We are clearly excited to have a gourd ol' time trick-or-treating tonight🎃🍬🍭 https://t.co/uKSt767u9U
1587151497602617344,2022-10-31 18:36:19+00:00,2,0,"And a special thank you, in honor of American #PharmacistsMonth, to the @ChapmanU pharmacy students who helped administer the vaccines, and for their commitment to patient care and healthy communities. #APhM2022"
1587150810181402631,2022-10-31 18:33:35+00:00,5,2,"Thank you to our dedicated community partners who made our Haunted Health Fair 🎃 this weekend a success. Because of your partnership, families from throughout OC were able to receive free access to eye screenings, blood pressure checks, COVID vaccines, flu shots, and more. https://t.co/k2NKrkps1b"
1586395246639792128,2022-10-29 16:31:15+00:00,3,0,"Come on down to Salk Elementary School for our Haunted Health Fair! You can get free flu shots, bivalent vaccines, eye screenings &amp; more. We will be here until noon 🎃👻 https://t.co/EuxseL0oVs"
1586057890468536320,2022-10-28 18:10:43+00:00,6,3,"The @NOCPublicSafety is paving the way to solving homelessness &amp; has proven itself as a successful model that should be replicated. 

Yesterday, we ushered in the next exciting phase of the Collaborative w/ the unveiling of a new homeless outreach hub. 
https://t.co/PqmQ4qs4Nn"
1585774287993982977,2022-10-27 23:23:47+00:00,20,2,"I’m very grateful to @CAgovernor for joining us today to commemorate the grand opening of the HOPE Center, which will serve as a central homeless outreach hub for community-based organizations &amp; law enforcement to coordinate resources under one roof. 
https://t.co/8tXhdSb35o https://t.co/LFuMrjeyyW"
1585649219032842242,2022-10-27 15:06:48+00:00,1,1,"With antisemitic incidents and hate crimes on the rise, we cannot remain silent nor can we take these hateful acts lightly."
1585649183985311744,2022-10-27 15:06:40+00:00,7,1,"Today, we remember the lives tragically lost during the Tree of Life Synagogue shooting in 2018.

As we now know, the shooter actively promoted antisemitism &amp; white nationalism on social media— highlighting once again that hate speech &amp; deadly violence are intrinsically linked. https://t.co/lxFOKPDPjp"
1585339860256436225,2022-10-26 18:37:31+00:00,6,1,"We are excited to have the @UCIrvineHealth Eye Mobile for Children at our Health Fair on Saturday👁️
Kids can get their prescription measured, and if needed, full eye exams, free glasses, and follow-up referrals by trained staff and ophthalmologists.

RSVP: https://t.co/CYbY4BKWWj https://t.co/JGFxnJjbge"
1584992546383880194,2022-10-25 19:37:25+00:00,4,2,I am proud to stand with Placentia Linda Hospital workers today as they advocate for just wages &amp; fair treatment. #FairWages4Health https://t.co/mMEw2hAPv8
1584967779404615683,2022-10-25 17:59:00+00:00,2,0,There is nothing scarier than missing out on holiday festivities. We will have free bivalent covid vaccines at our health fair this Saturday. RSVP &amp; spread the word: https://t.co/CYbY4BKWWj https://t.co/CbLQweRYVK
1584627952221712384,2022-10-24 19:28:39+00:00,5,2,(2/2) I stand with the Jewish community and other thoughtful leaders in condemning it in the strongest possible terms.
1584627880905973761,2022-10-24 19:28:22+00:00,16,10,"(1/2) This is awful- shocking, unnerving, and depressing. In 2022, in California no less, there is absolutely no place for this kind of toxic and divisive hate speech. The naked antisemitism displayed on the 405 freeway this weekend is deplorable and must not be tolerated. https://t.co/1hjIGMwb4S"
1584587039093424128,2022-10-24 16:46:04+00:00,1,1,"Naloxone &amp; fentanyl test strips will be available for free at our Haunted Health Fair this Saturday. 
RSVP: https://t.co/CYbY4BKWWj https://t.co/VBIHD3CfzR"
1583202071808946176,2022-10-20 21:02:43+00:00,4,4,"In partnership with local healthcare providers, my office is hosting a Haunted Health Fair on Saturday, October 29th with free medical screenings, health resources &amp; Halloween treats 🍭🎃

RSVP at https://t.co/CYbY4C1ZYj &amp; please share this info with your friends and neighbors. https://t.co/Fuuam1tPGI"
1582459959245082624,2022-10-18 19:53:49+00:00,3,0,"Yesterday, I had the opportunity to preview the new HOPE Center. As part of @NOCPublicSafety, this facility will serve as a unified resource center &amp; dispatch hub for homeless liaison officers to quickly &amp; effectively respond to people experiencing homelessness in the community. https://t.co/7WadvvWye9"
1582147598755909634,2022-10-17 23:12:37+00:00,15,5,"In 1985, activists took to the streets of LA to advocate for action during the AIDS crisis. 37 years later, the fight continues.
This weekend, I took part in #AIDSWALK2022 to support prevention, care, &amp; advocacy programs for 16,000+ people affected by HIV &amp; AIDS in LA County. https://t.co/tl8xECSc0d"
1581002841111420928,2022-10-14 19:23:45+00:00,3,1,"Do you know a friend, neighbor, or colleague who positively impacts our community?

Nominate them here for the chance to have them recognized as our next Citizen of the Month: https://t.co/Tf6kiXL1HR https://t.co/pK7FuGV8SK"
1580624477485862912,2022-10-13 18:20:16+00:00,0,0,"Congratulations to @BuenaParkPD's newly sworn-in Chief of Police, Frank Nunes. A U.S. Marine Corps veteran, Chief Nunes has bravely served in the Buena Park Police Department since 1997 and is well deserving of this position of leadership. https://t.co/62LZ0Oan0m"
1580281303047360513,2022-10-12 19:36:37+00:00,0,0,"I enjoyed touring MOMS OC yesterday and learning about the free resources they offer as one of the region's largest nonprofits focused solely on newborn and pregnancy health.

We even got to celebrate someone's very first bday🎂

Learn more about MOMS OC: https://t.co/of3hhamYUd https://t.co/oqe1FgiaFC"
1579961114296655873,2022-10-11 22:24:18+00:00,2,0,"My team &amp; I enjoyed passing out ice cream🍦this weekend at the 57th Annual @PlacentiaCA Heritage Festival and Parade.

This event features games, food, local businesses, a car show &amp; a parade showcasing high school marching bands. Congrats to the 1st place band, @hs_bar! https://t.co/g9rPuvh4fl"
1578455838603194369,2022-10-07 18:42:52+00:00,10,0,"Now that the #CALeg session has officially come to a close, I’m proud to be able to look back on what my team &amp; I have accomplished over the past two years, and I am very pleased to share that among the legislation signed by the Governor this year are 10 bills that I authored. https://t.co/VKwmC8Hxv8"
1578171205755863040,2022-10-06 23:51:51+00:00,2,1,Cool to see my small hometown of Poughkeepsie on the precipice of becoming a major manufacturing hub in the US! https://t.co/Q159hyQ0Qj
1578122210471878657,2022-10-06 20:37:09+00:00,38,12,"This morning, I joined a robust coalition of advocates announcing California's efforts to secure federal funding for a hydrogen hub. #H2 technology will accelerate our transition to decarbonization while also creating high-paying jobs and powering the world’s 5th largest economy. https://t.co/QqtS2pI40G"
1577768479167377409,2022-10-05 21:11:33+00:00,18,6,"This week, I had a chance to check out @FoothillTransit's impressive green fleet which includes 13 hydrogen fuel cell buses. They even let me take a turn behind the wheel 🚌

These buses can be refueled in 6-20 minutes and travel up to 350 miles on a single refueling 💧 https://t.co/3hBAYoM9x4"
1577406444772605953,2022-10-04 21:12:57+00:00,5,2,"Expanding access to public transportation decreases greenhouse gas emissions, reduces congestion on our streets, and opens doors to economic opportunity. 

Thank you @CAgovernor for signing #SB942 which ensures the long-term viability of free &amp; reduced-fare transit programs. https://t.co/9w6EygXw9M"
1577347992679419904,2022-10-04 17:20:41+00:00,7,1,"I was pleased to honor Juan Garcia as our September Citizen of the Month. 

As Coordinator of the @CypressCollege Veterans Resource Center, Juan is committed to helping students successfully transition from military service to academic life &amp; reach their highest potential. https://t.co/5EBQk9SsVx"
1577053569098084352,2022-10-03 21:50:45+00:00,7,1,"This weekend, my family &amp; I joined the Irvine #Walk2EndAlz in honor of my mother-in-law, Shirley Lewis.

Thank you @alzassociation for your dedication to finding a cure for this heartbreaking disease. #ENDALZ https://t.co/yt0hkqaKXK"
1577006296187838465,2022-10-03 18:42:55+00:00,4,1,"In order to cut down on wait times at the DMV, I authored #SB1193 which provides online options for various notices &amp; processes. I am excited to share it was signed by the @CAgovernor.
#CALeg https://t.co/OzEVfRWJRp"
1575892949774131210,2022-09-30 16:58:52+00:00,12,6,"Currently, CA's data on childhood drownings is inconsistent &amp; incomplete, preventing a comprehensive evaluation of drowning prevention strategies.

#SB855 creates a system for collecting this essential info &amp; will help inform future policies to reduce these tragedies. #CALeg https://t.co/xpHmx1Fhfp"
1575260809319489536,2022-09-28 23:06:58+00:00,2,1,"The reauthorization of the District of Choice program is essential for the tens of thousands of students who have come to depend on the program for educational opportunities that otherwise would be unavailable.

Thank you @CAgovernor for signing #AB185. 
https://t.co/EXMiiy6MFd https://t.co/SNTHSQf4sh"
1574594666363691008,2022-09-27 02:59:57+00:00,15,5,"Under this urgently needed legislation, democracy's frontline workers will be appropriately protected from the kinds of threats, harassment &amp; physical intimidation that have recently become all too common. Thank you @CAgovernor for signing #SB1131.

https://t.co/oNECRG55zC #CALeg https://t.co/mDGMuat8iv"
1574524285003046912,2022-09-26 22:20:17+00:00,0,1,"Tomorrow 11am-3pm, @FullColl is hosting a vaccine clinic equipped w/ Pfizer &amp; Moderna 1st, 2nd &amp; updated booster shots. 

Walk-ins will be accepted. You may also sign up for an appointment here: https://t.co/lj1cqHLyoe.

➡️Fullerton College Building 200, Rm 224/226 https://t.co/r0ruvPjGQ7"
1574496673186750465,2022-09-26 20:30:34+00:00,0,0,"I was proud to recognize Bageloo as our Restaurant of the Month 🥯 

Offering made-from-scratch New York-style bagels, French American pastries &amp; craft roasted coffee, Bageloo is a beloved community spot in @DiamondBarCity.

➡️1200 S Diamond Bar Blvd #102, Diamond Bar, CA 91765 https://t.co/v6sdHYLlOC"
1573464045553786881,2022-09-24 00:07:16+00:00,10,0,"Today, we received hundreds of letters from local middle schoolers urging action to curb the e-cig epidemic among teens. This is the kind of civic engagement that pushes good, meaningful policy forward &amp; ensures a healthy democracy. https://t.co/JqbXvbu3HB"
1573062080881520640,2022-09-22 21:30:00+00:00,3,0,"America's increasingly hostile &amp; polarized political environment has left election workers caught in the crossfire.

I applaud the efforts of the newly formed Cmte for Safe &amp; Secure Elections and look forward to their insights on this critical issue. https://t.co/ly50ocSVT3"
1573006932734246912,2022-09-22 17:50:52+00:00,8,0,"I enjoyed visiting the @CypressCollege Veterans Resource Center, where they offer an extensive range of resources to service members &amp; veterans, including academic counseling, disability accommodations &amp; financial aid assistance.  

I couldn't leave w/o a trip to the bookstore👕 https://t.co/GavPHoOANv"
1572695006275837953,2022-09-21 21:11:23+00:00,2,0,"To kick off #HispanicHeritageMonth, my team joined @WestCovinaCity &amp; UNIDOS Community Events for their annual fiesta 🪅 

This event brings together businesses, community partners &amp; residents in a celebration of the contributions &amp; traditions of the Hispanic community. https://t.co/i6fLlLBM6J"
1572622277308715008,2022-09-21 16:22:23+00:00,2,2,"Thank you Rodeo 39 for capturing these special moments from our Annual Mid-Autumn Festival in @CityofStanton 🙌

It was great to partner w/ @SenatorUmberg, @DiedreThuHa, @OCAutism_ &amp; Stanton City Councilmember Alyce Van on this year's festivities. https://t.co/3Oe2XmBqyA"
1572311748681801728,2022-09-20 19:48:27+00:00,3,1,"After a great meeting with @FullColl Interim President Dr. Perez, we ran into some bright young students registering their peers to vote on campus for #NationalVoterRegistrationDay 🗳️🇺🇸 

Register to #vote today: https://t.co/VZJpZ6ZhPd https://t.co/BIfbzf9mqE"
1572267388128866304,2022-09-20 16:52:11+00:00,6,3,"ICYMI: Last week, @CAPublicHealth launched https://t.co/maqAcvQK2B, which includes info about: 
- accessing abortions
- your legal rights
- finding providers
- paying for services
- financial assistance
- wellness &amp; emotional support
+ MORE

(for people in &amp; outside of CA) https://t.co/LQjg5IcqGo"
1571986664003874818,2022-09-19 22:16:41+00:00,6,1,"Service members shouldn't have to pay for a license they aren't using while they are serving our country on active duty. Thank you @GavinNewsom for signing #SB1237, which waives burdensome licensure requirements and fees for service members on active duty. #CALeg https://t.co/BZoCUKA3WH"
1571930238644539393,2022-09-19 18:32:28+00:00,5,0,"During summer recess, I visited Camp Grace at High Desert State Prison. I was immensely impressed by this innovative program that provides space for incarcerated dads &amp; their kids to connect, heal &amp; grow. This is a model worth replicating across CA. https://t.co/HjuGGWlMG5"
1570894525136252928,2022-09-16 21:56:55+00:00,14,2,"Thank you @GavinNewsom for signing the Responsible Battery Recycling Act as part of the climate package🌎

#SB1215 &amp; #SB2440 will create a statewide collection and recycling program for consumer batteries and products that contain batteries 🔋♻️ #CALeg 
https://t.co/lhcjQdGvl9 https://t.co/Hsai3N8dD4"
1570870752987193344,2022-09-16 20:22:27+00:00,1,1,"The Orange County oil spill amplified the need for a trained and readily accessible workforce to preserve, protect &amp; restore our coastline. My #SB1036 will do just that. 

https://t.co/dX7g6f8dVB @CalMatters @HireYouth @terrytamminen"
1570454300618559488,2022-09-15 16:47:37+00:00,2,0,"Thank you @YLAexpo for inviting me to speak at the 1st Youth Leadership Summit in @City_of_Anaheim. In our workshop, students reflected on how they could use their voices to advocate for change. We can all look forward to hearing more from these young leaders in the future. https://t.co/qInMleMi7N"
1569817397330329601,2022-09-13 22:36:47+00:00,9,3,"Always good to see @csuf President Fram Virjee. We discussed the plans for the new Innovation Hub at @csufecs. This state-of-the-art facility will support OC's increased demand for a highly skilled, STEM-trained workforce. I look forward to seeing it come to fruition! https://t.co/E7QWWup9LU"
1569744729419710464,2022-09-13 17:48:02+00:00,2,0,"My family &amp; I enjoyed walking w/ @SecondHarvestFB this weekend at the inaugural Walk to Feed OC🍓🚶‍♂️

As part of #HungerActionMonth, the goal of the event was to raise awareness about food insecurity in OC. All of the proceeds will support local hunger-relief efforts. https://t.co/j9AfvcJyC4"
1569482274512707584,2022-09-13 00:25:08+00:00,2,1,"This weekend, I joined the Federation of World Peace and Love &amp; the Tai Ji Men Qigong Academy in ringing the Bell of Peace in solemn tribute to the thousands of lives lost on 9/11.

I was honored to be included in this powerful ceremony promoting peace &amp; shared prosperity. https://t.co/jL87ORrvIn"
1569450227387760641,2022-09-12 22:17:47+00:00,2,0,"For the first time in 3 yrs, we celebrated @CityofStanton's #MidAutumnFestival in person.

With live performances &amp; traditional lion dancing, the event was a celebration of happiness, gratitude &amp; prosperity. We love this annual tradition &amp; look forward to next year 🏮 https://t.co/fdbR8WBjhS"
1569412613687365632,2022-09-12 19:48:20+00:00,3,0,"Now in its 5th year of operation, @NOCPublicSafety takes a deliberately collaborative approach to address the root causes of homelessness.

To learn more about this innovative model &amp; how it works, check out this 30-minute PBS episode by @DavidNazarNews📺
https://t.co/IDDdU86rbb"
1568316906305908736,2022-09-09 19:14:23+00:00,2,2,"We kicked off fall recess last weekend (literally!) with gravity-defying kicks and flips, K-pop dance, and ensemble choir performances 🥋🎶

In partnership w/ the @cityoffullerton &amp; Mayor @FredHJung, it was a privilege to join the Korean community in celebrating Taekwondo Day🇰🇷 https://t.co/atU93a7uTl"
1568272160178991105,2022-09-09 16:16:34+00:00,3,1,"As Chair of Friends of @Anaheim_Library, Nancy Carlberg has made a lasting &amp; positive impact on the community, and I am pleased to honor her as our Citizen of the Month for August. Her tireless work ensures that reading remains accessible &amp; inviting for the entire community📚 https://t.co/9g7GCcgAmd"
1567968749613088768,2022-09-08 20:10:56+00:00,2,1,"Mark your calendars bc the @FullertonCA Museum Center is debuting ""Picturing America's Pastime"" this Saturday. I was fortunate to get a sneak peek of the exhibit, which features 51 framed photographs from the Hall of Fame’s expansive collection &amp; captures the essence of baseball. https://t.co/fYmwwK56WA"
1567608808972910592,2022-09-07 20:20:39+00:00,1,2,"Join us this Saturday to celebrate @CityofStanton's 3rd annual Mid-Autumn Festival. This beloved Vietnamese festival brings families together for a day of games, dancing &amp; sweet treats. Complimentary mooncakes, snacks and lanterns will be available🏮 https://t.co/J0wlY3YqVI"
1567274242072522752,2022-09-06 22:11:12+00:00,75,23,"As a dog dad of 4 chihuahuas, I can only imagine how heartbreaking it would be to give up a pet to secure housing🐕

My bill to expand pet-inclusive housing was signed into law &amp; ensures pet ownership is 🐾paw🐾sible for more Californians. #SB971 #CALeg

https://t.co/K7ODnYSZml https://t.co/ekfe5sKV5j"
1566907800898310144,2022-09-05 21:55:06+00:00,5,1,"Today, we celebrate &amp; thank the unions and organizers who fought for fair wages, workers’ rights, and safer working conditions for all. Their grit &amp; tenacity has benefited all American workers. #LaborDay2022 https://t.co/ZrI2bOaziK"
1566138963953299456,2022-09-03 19:00:01+00:00,155,36,"Congratulations to @BAPSLosAngeles on celebrating its 10th anniversary! Since 2012, the mandir has served as a notable icon of Hindu culture &amp; faith in Southern CA.

Fun fact: This is the 1st earthquake-proof temple in the world &amp; 5th traditional Hindu mandir in North America. https://t.co/jrAIO7u6y3"
1565843715557453824,2022-09-02 23:26:48+00:00,0,1,"This Sunday, you won't want to miss the Taekwondo and KPop dance demonstration by the Chosun University Taekwondo and K-Pop Dance teams at @csuf 🥋🎵

Admission &amp; parking is FREE!
Spread the word &amp; share with friends🗣️ https://t.co/iii1YuEiMC"
1565827239601528832,2022-09-02 22:21:20+00:00,7,0,"On a hot day like today, splash pads are the place to be! ☀️💧

Great to see funds that I secured in the 2017-18 #CABudget in action.

For more info on splash pads in @La_Habra_OC visit: https://t.co/eK3vmMjlgE https://t.co/w5EC4FrMgr"
1565780323945787392,2022-09-02 19:14:54+00:00,1,2,"This legislation is, sadly, very much needed to protect the Californians who do the largely thankless but essential work so critical to safeguarding our democracy.

#SB1131 is now on the Governor's desk awaiting signature. #CALeg
https://t.co/aWOX73WXui @adambeam"
1565437287776669696,2022-09-01 20:31:48+00:00,21,3,"That's a wrap on the 2021-22 #CALeg session. 11 of my bills made it to Governor @GavinNewsom ✅

Thank you to my committed staff for their tireless work this year. https://t.co/ZZToZCX9CB"
1565164843698532353,2022-09-01 02:29:12+00:00,27,4,"After 8 years of hard work by a diverse coalition of advocates, I am proud to help push this effort over the finish line. #SB1215 &amp; #AB2440 will create a groundbreaking statewide collection &amp; recycling program for batteries &amp; battery-embedded products.
https://t.co/juWYAloaoc https://t.co/u3WdA1GivZ"
1564683073047777281,2022-08-30 18:34:49+00:00,3,2,"The CA Ocean Corps will train a workforce that is ready to respond quickly &amp; efficiently to coastal emergencies, such as the oil spill off of Orange County last fall. #SB1036 #CALeg @HireYouth @Surfrider_CA 

https://t.co/hBJZS2qA8j"
1563314389939171328,2022-08-26 23:56:10+00:00,10,1,"#SB835 will ensure that the families of deceased legislative employees may remain on the Legislature’s health plan for up to 120 days in the aftermath of a tragedy. #CALeg

The signing of this bill comes a day after the one-year anniversary of Marc Hanson’s passing. https://t.co/SC3JxYoGO1"
1563295852633829376,2022-08-26 22:42:30+00:00,0,0,"Tomorrow the USA-Philippine Biz Association is hosting the 1st Filipino-American Frontliners Heroes’ Day at @WestCovinaCity Civic Center. The event will feature entertainment, Filipino food &amp; booths. Don't miss the team Newman ice cream truck!🍦🚚

RSVP: https://t.co/ZNECYwLsJS https://t.co/kcYtlqw8JF"
1562861899473047553,2022-08-25 17:58:08+00:00,33,2,"He is remembered for the way he made people feel and the energy and enthusiasm with which he embraced all parts of his life. His absence has left a void in our team and our hearts.
We miss you, Marc. (2/2)"
1562861684166774784,2022-08-25 17:57:16+00:00,130,11,"Hard to believe that a year has passed since the tragic loss of my Chief of Staff and dear friend, Marc Hanson. A deeply committed and compassionate public servant, Marc's memory carries on every day as we continue to do the work he was so passionate about. (1/2) https://t.co/VkoqLdR5Zm"
1562562442957291520,2022-08-24 22:08:12+00:00,7,2,"Last week, I was privileged to recognize @CBHideout as SD29's Small Business of the Year.

Located in @FullertonCA, the Hideout boasts a collection of 100,000+ comics &amp; has built a strong community drawn together by a common love of art, music, &amp; of course, comics. https://t.co/5svSdayWW4"
1562495939180314625,2022-08-24 17:43:56+00:00,5,2,"#SB1036 is headed to the Governor! #CALeg

The California Ocean Corps will work to: 
☀️address climate change
🌊restore coastal watersheds &amp; habitats
🏖️provide public access to the coast
🌧️deal w/extreme weather events or other natural &amp; man-made hazards

https://t.co/VDiSYS7GGk"
1562142429850914816,2022-08-23 18:19:13+00:00,8,3,"It’s been a pleasure to work w/ @CalPSC on #SB1215, which will create a statewide recycling program for battery-embedded products ♻️🔋 
I am honored to be recognized with their Legislative Excellence Award.

Yesterday, the bill passed out of the Assembly 61-1. #CALeg https://t.co/W8OQx6PHUe"
1561912581047996416,2022-08-23 03:05:52+00:00,9,2,We must do a better job of protecting democracy's frontline workers. #SB1131 will provide protection to election workers facing harassment. https://t.co/LjBTTeaQwv
1561800240436432896,2022-08-22 19:39:28+00:00,5,2,Privileged to be a panelist at the annual @Mobility21 Southern California Transportation Summit on Friday. I enjoyed the robust discussion about California's clean-energy goals and how we can better and more equitably invest in the transportation sector. https://t.co/QabeeYdfsK
