id,created_at,favorite_count,retweet_count,text
1290856052305481728,2020-08-05 03:44:00+00:00,0,0,"The fact that it is not, by all indications, represents yet another apparent indication that our public institutions and the political system that determines their shape are continuing to fail us. We deserve better than this."
1290856051449847809,2020-08-05 03:44:00+00:00,0,0,"It seems reasonable to have assumed that the state’s data processes, which have been in place for months, would at this point be properly configured and reliable."
1290856050615189504,2020-08-05 03:44:00+00:00,0,0,"Above and beyond all of the various issues resulting from questionable decisions throughout the pandemic—when and how rapidly to open, whether to require the wearing of masks, how best to respond the recent surge, etc.—"
1290856049742737409,2020-08-05 03:43:59+00:00,0,0,it’s more important than ever that people should be able to trust in the accuracy of data and the competence and integrity of the health systems charged with collecting that data.
1290856048874545152,2020-08-05 03:43:59+00:00,0,0,"Among other things, the ongoing pandemic provides vivid proof that there are things that only government can do. At a time where scientific evidence and expert advice are being increasingly disparaged and rejected on the basis of politics and ideology..."
1290856048086011911,2020-08-05 03:43:59+00:00,0,0,"state officials also acknowledged that there is currently a backlog of more than 17,000 tests which have yet to be analyzed and reported."
1290856047272325120,2020-08-05 03:43:59+00:00,0,0,"Meanwhile, California Department of Public Health staff are trying to determine where data is “getting stuck.” In addition to whatever seems to be wrong with the state’s CalREDIE electronic data reporting system..."
1290856046425120768,2020-08-05 03:43:59+00:00,0,0,"Consequently, there are now serious questions as to whether the apparent decline in transmission rates, which according to daily data declined more than 20% over the past week, represents genuine progress or is simply a byproduct of faulty data."
1290856045707853824,2020-08-05 03:43:58+00:00,0,0,"The extent of the undercounting is unclear, and it’s also unclear how long the problem has persisted."
1290856044961263619,2020-08-05 03:43:58+00:00,0,0,so that the most recent numbers may appear better than they as a result of undercounting of positive test results.
1290856044143366144,2020-08-05 03:43:58+00:00,0,0,"In addition to problems with the speed at which test results are being analyzed and reported, there appears to be a larger problem affecting the collation and counting of the data itself..."
1290856043233390592,2020-08-05 03:43:58+00:00,0,0,as the result of “technical issues” affecting the data system used to process COVID-19 test results.
1290856042251710466,2020-08-05 03:43:58+00:00,0,0,"The lower case totals for the past few days come with a major qualification— earlier today, California Health and Human Services Secretary Dr. Mark Ghaly warned that recent data on new coronavirus infections was very likely inaccurate..."
1290856041337352192,2020-08-05 03:43:57+00:00,0,0,"There was one reported new death attributed to the coronavirus, in the city of @WestCovinaCity, bringing its total to date to 33, the second-highest total in the senate district (albeit well behind @City_of_Anaheim's cumulative total of 157 since the start of the pandemic.)"
1290856040569778177,2020-08-05 03:43:57+00:00,0,0,"That’s another substantial decrease from yesterday’s total of 164, which was itself a meaningful decrease from the prior day’s total of 226."
1290856038367784960,2020-08-05 03:43:57+00:00,1,0,"#SD29 #Coronavirus Update for Tuesday, August 4th: a total of 135 reported new confirmed cases of #COVID19 across the 16 cities of California’s 29th Senate District. https://t.co/PkrntRDMev"
1290695323564875778,2020-08-04 17:05:19+00:00,2,0,"A very happy birthday to former President @BarackObama, who turns 59 today. 

Even if you've seen this before, it's well worth another watching (even if there's a ""Take the Trump Survey"" ad preceding it, which seems to always happen):

https://t.co/tOgSKk4dsO"
1290518545420361728,2020-08-04 05:22:52+00:00,5,4,"Take a moment to read up on advice from @CAL_FIRE so you can be prepared and protect those you care about in case you need to evacuate quickly. 

#AppleFire #Wildfire 

https://t.co/fqFE04QnqB"
1290518544342425600,2020-08-04 05:22:52+00:00,4,2,"While the #AppleFire in Cherry Valley remains outside the 29th State Senate District, it’s an important reminder that a wildfire can get out of control quickly and force evacuations."
1290473096709722112,2020-08-04 02:22:16+00:00,0,2,"#SD29 #Coronavirus Update for Monday, August 3rd: a net total of 164 new confirmed cases of #COVID19 across the cities of California’s 29th Senate District. https://t.co/xOS8L0ytWi"
1290330654110973954,2020-08-03 16:56:15+00:00,0,0,"The classic definition of a ""Win-Win"": donation in support of my campaign for state senate, and be entered for a chance to win your very own Anthony #Fauci limited-edition bobblehead. 

Deadline for entries is August 11th.

https://t.co/7x8JyEemnw https://t.co/VzEKRYwesI"
1290122143846473728,2020-08-03 03:07:43+00:00,0,0,"His Op-Ed in the Washington Post is an affirmation of the meaning of service, the value of integrity, and the need to continually remind ourselves what it takes to maintain the essential ideals which have always served as the foundation of America’s success."
1290122142994989056,2020-08-03 03:07:42+00:00,0,0,"It’s encouraging to hear that LTC Vindman stands by his decision to testify, without regret, even if it ultimately came at a very high professional and personal cost."
1290122142143483904,2020-08-03 03:07:42+00:00,0,0,Army Lieutenant Colonel Alexander Vindman was among those who came forward with some of the facts about Donald Trump’s solicitation of “dirt” on Joe Biden’s son from Ukraine in return for American military assistance.
1290122141275324416,2020-08-03 03:07:42+00:00,3,1,"The news cycle runs at hyper-speed these days, so much so that the events of the impeachment process earlier in the year seem like eons ago. But it’s important not to forget certain things. 

https://t.co/Vv25QnB55b"
1290059335351955456,2020-08-02 22:58:08+00:00,0,0,"@OCGovCA Registrar of Voters:
https://t.co/hoEck44eGi

@SBCounty Registrar of Voters: https://t.co/1dqD22xkey

@CountyofLA Registrar of Voters:
https://t.co/1x7HKN8K9D"
1290030694312210432,2020-08-02 21:04:19+00:00,1,1,"Not totally sure? Always better safe than sorry.  Click on this link to ensure that you're up to date:  https://t.co/ZvRQaFS0y6 

#Election2020 #NewmanforSenate #BetterSenator"
1290030693293023232,2020-08-02 21:04:19+00:00,2,1,"But if you happen to have moved since the last time you voted, in order to receive and cast your ballot this November, it's very important that you make sure that your registration is current."
1290030691854381057,2020-08-02 21:04:19+00:00,3,0,#California has one of the most thorough and inclusive approaches to voter registration of any state in the country. https://t.co/a08xJltMFN
1289969218964852746,2020-08-02 17:00:02+00:00,2,0,"Happy ""National Sisters Day"".  

As Amy Li puts it perfectly: “Having a sister is like having a best friend you can’t get rid of. You know whatever you do they’ll still be there.”

I couldn't be more grateful for mine.

#NationalSistersDay https://t.co/eEUcBc9NBJ"
1289802323561127937,2020-08-02 05:56:51+00:00,2,1,"#SD29 #Coronavirus Update for Saturday, August 1st: a total of 221 new confirmed cases of #COVID19 across the cities of California’s 29th Senate District, up from yesterday’s total of 174, but otherwise generally consistent with the trend over the past 7 days. https://t.co/1N81Ky3D24"
1289757012352315393,2020-08-02 02:56:48+00:00,1,1,"If you haven’t done so already, you submit your response to the census online at https://t.co/s2gkD8xcsU or over the phone in English by dialing 844-330-2020 or in Spanish at 844-468-2020. #2020 #Census"
1289757011609935874,2020-08-02 02:56:48+00:00,0,0,"For a deeper understanding of the Census and its impact, check out this informative piece by Myra Miranda of NALEO."
1289757010829836290,2020-08-02 02:56:48+00:00,1,0,"the Census determines the allocation of seats for the US House of Representatives as well as how federal funds will be distributed, including funds essential programs essential for the most vulnerable in our communities."
1289757009982627842,2020-08-02 02:56:48+00:00,0,0,"In addition to being a constitutional requirement (Article 1, Section 2: “[An] Enumeration shall be made within three Years after the first Meeting of the Congress of the United States, and within every subsequent Term of ten Years, in such Manner as they shall by Law direct.”)"
1289757009105969153,2020-08-02 02:56:48+00:00,4,1,"There's obviously a lot going on right now, a lot to worry about, a lot to do. But please don't forget about the #Census. 

https://t.co/SHShCoFlYn"
1289668359269695488,2020-08-01 21:04:32+00:00,4,1,"Just click on the link below and fill out the form and we’ll quickly and safely get a sign to you: https://t.co/TFSBi0GEpV.

#BetterSenator #NewmanForSenate"
1289668354676948992,2020-08-01 21:04:31+00:00,5,5,Need a quick fix for brightening up your yard this summer at no cost? One brand new well-dressed yard should be quite the addition. Help spread the word on one of the right ballot choices in the upcoming November voting. https://t.co/5d8ziWYmm0
1289607348156166146,2020-08-01 17:02:06+00:00,1,0,A big shout-out to these little guys for making life just a little more fun and cheerful. #Dogust Universal Birthday for Shelter Dogs. https://t.co/O0aUohn862
1289396674721247233,2020-08-01 03:04:57+00:00,0,0,"Click on the link below and make a modest donation to our state senate campaign, and be entered for a chance to win your very own Dr. Fauci bobble-head.

https://t.co/cMipZpsnhG

Hurry, the deadline to submit is August 11th!"
1289396672804433920,2020-08-01 03:04:57+00:00,0,0,"We're still with #DrFauci, and we only wish Donald Trump was, too.

Dr. Fauci (or at least his bobble-head likeness from the National Bobblehead Hall of Fame) could with you too. https://t.co/GBFWXNRwEe"
1289353429970649089,2020-08-01 00:13:07+00:00,0,0,"minimizing travel and close physical contact wherever possible, avoiding crowded spaces, (particularly indoors), and by washing your hands frequently."
1289353429156937728,2020-08-01 00:13:07+00:00,0,0,"As you go into what is forecast to be a hot and sunny weekend, please continue to conscientiously keep doing your share in protecting yourself and others from infection by wearing masks in public settings..."
1289353428255162370,2020-08-01 00:13:06+00:00,0,0,Whether or not younger children are more or less likely than adults to be agents for the transmission of the coronavirus while not showing symptoms is also being studied.
1289353427416309761,2020-08-01 00:13:06+00:00,0,0,"Younger children, in general, either aren’t contracting the virus at the same rates or aren’t showing symptoms like other people, although health experts don’t yet have any good hypotheses as to why."
1289353426627829762,2020-08-01 00:13:06+00:00,0,0,"while declining to provide additional information about their age or county of residence, citing patient privacy concerns."
1289353425793105921,2020-08-01 00:13:06+00:00,0,0,"This trend, which was initially observed in people in the 18-40 range, now includes teenagers in larger numbers. Today California even reported the first juvenile death from coronavirus infection. Officials said the teen who died had one or more underlying health conditions..."
1289353425021411329,2020-08-01 00:13:06+00:00,0,0,"particularly those in their late 20s and early 30s, coming down with COVID-19."
1289353424153141248,2020-08-01 00:13:06+00:00,0,0,"As noted in previous posts, one of the more pronounced trends in the recent surge of the coronavirus in both California and locally, public health experts have noted a slow but discernible shift in who the virus has been infecting, with an increasing share of younger people..."
1289353423247142912,2020-08-01 00:13:05+00:00,0,0,"Today’s totals also included four new deaths attributed to the novel coronavirus, all in Anaheim, which continues to experience the highest mortality rate of any city in the district, and among the highest in the region."
1289353422341197824,2020-08-01 00:13:05+00:00,0,0,"This may or may not be part of a promising trend, since it’s still unclear if the recent reporting issues affecting the state’s electronic data reports system have been repaired, as well as the extent to which the problem has been depressing numbers on new confirmed cases."
1289353420453765122,2020-08-01 00:13:05+00:00,2,1,"#SD29 #Coronavirus Update for Thursday, July 30th: a total of 174 new confirmed cases of #COVID19 across the cities of California’s 29th Senate District, down slightly from yesterday’s reported new confirmed case total of 190. https://t.co/gPiOcip2gQ"
1289322292426678273,2020-07-31 22:09:23+00:00,1,1,"Sign up via the link below to be a part of the effort to take back California's 29th Senate District in the name of active, responsive, and principled representation: 

https://t.co/2IEMpX6ASK

#BetterSenator #NewmanforSenate"
1289322290933460992,2020-07-31 22:09:23+00:00,1,1,"We're 95 Days from #ElectionDay. The time to roll up our sleeves (and this year, to put on a mask and gloves as well) is here. https://t.co/ebVMheoAgD"
1289245246262411267,2020-07-31 17:03:14+00:00,1,1,"Every takeout meal you order is not only a nice respite from your own daily grind, but a lifeline to a neighbor as well.   

#InThisTogether"
1289245245029232642,2020-07-31 17:03:14+00:00,1,1,"Under the current restrictions, most local restaurants are limited to takeout or outside dining with reduced seating capacity to allow for social distancing, straining their ability to make the numbers add up and keep their businesses viable."
1289245244228136965,2020-07-31 17:03:13+00:00,1,1,Restaurant owners and staff have had to find all manner of creative ways just to keep their doors open.
1289245243229892608,2020-07-31 17:03:13+00:00,1,2,"When our team developed our #Takeout4Good campaign shortly after the start of the crisis, we wanted to highlight the plight of local restaurant owners and the pressures they're under during the downturn caused by the #pandemic. 

https://t.co/hweJ7udduC"
1289042187133435904,2020-07-31 03:36:21+00:00,0,0,"Today’s totals also include 9 new deaths attributed to coronavirus infection: five in the city of @WestCovinaCity, two in @City_of_Anaheim, and one each in the cities of @cityofbrea and @LaHabraCA."
1289042186382659584,2020-07-31 03:36:21+00:00,0,0,"This is more or less the same effective number as yesterday, since today’s totals include a downward revision against yesterday’s reported new cases in the city of @Chino_Hills, which appears to have been the result of an input error."
1289042184147103749,2020-07-31 03:36:20+00:00,0,0,"#SD29 #Coronavirus Update for Thursday, July 30th: a total of 190 new confirmed cases of #COVID-19 across the cities of California’s 29th Senate District. https://t.co/EqvLkZywd8"
1288907726119026688,2020-07-30 18:42:03+00:00,1,0,"The board's most recent act is the pandemic equivalent of adding insult to injury. Orange County's students, teachers, parents, and taxpayers deserve better than the board's current ideologically-driven, poorly considered actions."
1288907725250818048,2020-07-30 18:42:03+00:00,1,0,I'm already on record as firmly objecting to the OCBE's recommendation to open schools while rates of infection are still high and without proper safeguards.
1288907720486088705,2020-07-30 18:42:01+00:00,0,0,This unanimous vote was cast despite public input overwhelmingly opposing both the move toward litigation and the board's current position on reopening schools without proper PPE or social distancing guidelines in place.
1288907719697547266,2020-07-30 18:42:01+00:00,0,0,"(Becky Gomez, the smartest member of the 5-member board, was absent), to sue the state of California to overturn the state's current orders preventing public schools from holding in-person classes and resuming services on campus."
1288907718820917249,2020-07-30 18:42:01+00:00,1,1,"In the latest example of its abrogation of responsible governance, not to mention the gravity of the current reality, last night the members of the Orange County Board of Education cast a 4-0 vote...

@VoiceofOC 

https://t.co/J9Kqn7SAm6"
1288905432866541568,2020-07-30 18:32:56+00:00,0,1,This ↓ https://t.co/P6sbG66gvW
1288869697908125697,2020-07-30 16:10:56+00:00,1,2,"We have our marching orders from a man who never gave an inch to hate, never paused for ignorance and never tired in his pursuit to make our nation a more perfect union.

Together, You Can Redeem the Soul of Our Nation https://t.co/uQIUASD2z7"
1288686571336552448,2020-07-30 04:03:15+00:00,1,0,"Please continue supporting family-owned restaurants like @Alza_Osteria, so they'll still be there to host celebratory meals when the #COVID crisis is finally behind us."
1288686568073383936,2020-07-30 04:03:15+00:00,1,0,Thanks as well to @AlzaOsteria in @cityofbrea for providing such a terrific meal on short notice. Restaurants everywhere are facing daunting challenges as a result of the #pandemic and the downturn it has caused. https://t.co/20ae7NFp6z
1288686564071976961,2020-07-30 04:03:14+00:00,1,0,"It was our modest way of recognizing and honoring the @NUHW members of Kindred's Brea caregiving team for their courage, compassion, and expertise in the fight against the #coronavirus and in support of its victims. https://t.co/YDS8jtdyPw"
1288686561303777280,2020-07-30 04:03:13+00:00,2,0,"Yesterday, the campaign team did another #Takeout4Good for the fearless and committed health care professionals at Brea's @kindredhealth Transitional Care Hospital. https://t.co/WVT5nW6uYC"
1288651205585989632,2020-07-30 01:42:44+00:00,2,1,"Trump, America’s Scammer-in-Chief, is back on his hydroxychloroquine bit. 

You'd think a fraud whose life’s work is to fleece &amp; deceive, would avoid shilling an old faux cure &amp; find a ‘validator’ other than quack doc who blames ‘spirit demons’ for endometriosis? #HurryUpNovember https://t.co/5tldSoDPah"
1288636321284513792,2020-07-30 00:43:35+00:00,0,0,"minimizing travel and close physical contact wherever possible, avoiding crowded spaces, (particularly indoors), and by washing your hands frequently."
1288636320403697664,2020-07-30 00:43:35+00:00,0,0,You can continue to do your share in protecting yourself and others from infection by conscientiously wearing masks in public settings...
1288636319439052805,2020-07-30 00:43:34+00:00,0,0,a large number of the recent cases and the deaths they have produced could have been avoided.
1288636318453338114,2020-07-30 00:43:34+00:00,0,0,"That’s obviously no real consolation, especially to the families who will have lost or will lose loved ones to the virus, especially considering the fact that one could make a very persuasive argument that with a better, more consistent and more cohesive response and plan..."
1288636317467676672,2020-07-30 00:43:34+00:00,0,0,"As mentioned in prior posts, virus-related deaths are what epidemiologists refer to as a “lagging indicator”, which is to say deaths reported today are actually the manifestation of the high virus levels we were seeing three and four weeks in the past."
1288636316238766081,2020-07-30 00:43:34+00:00,0,0,"Despite the thankfully low number of deaths in our area over the past few days, the state of California as a whole today reported the highest number of reported #COVID-related deaths in a single day since the start of the pandemic, with 174 reported."
1288636315102150656,2020-07-30 00:43:33+00:00,0,0,"Experts point to what has been described as a “perfect storm” of a combination of living situations, workforce demands, and underlying conditions as explanations for these disparities."
1288636314003206144,2020-07-30 00:43:33+00:00,0,0,"In California, LatinX people comprise 39% of the state’s total population, but are currently accounting for 54% of COVID-19 cases and 46% of deaths."
1288636311797022721,2020-07-30 00:43:33+00:00,0,0,"As noted yesterday, this is a by-product of a larger issue as it relates to the virus, where Latino communities have been seeing rates of infection, hospitalization, and mortality at rates substantially above other demographic groups."
1288636310719143938,2020-07-30 00:43:32+00:00,0,0,"Today’s totals include only one new death attributed to the novel coronavirus, in the @City_of_Anaheim, which has experienced virus-related mortalities at the highest rate of any city in the district."
1288636309523673088,2020-07-30 00:43:32+00:00,0,0,"Of the three counties, @CountyofLA Department of Health has been the most deliberate and transparent about flagging the problem, while noting that case numbers may jump back up, at least temporarily, when the issue is finally resolved and the backlog is emptied."
1288636308512940032,2020-07-30 00:43:32+00:00,0,0,"What is clear, however, is that this problem is affecting the data from each of the three counties whose borders fall within the 29th Senate District."
1288636307497873408,2020-07-30 00:43:32+00:00,0,0,"which has caused some level of under-reporting over the past week or so, though the extent of the under-reporting remains unclear."
1288636306302500864,2020-07-30 00:43:31+00:00,0,0,"The numbers on which that trend are based, however, come with a qualification: there’s apparently a data sharing processing/distribution issue currently affecting the state’s electronic labs system..."
1288636304557711362,2020-07-30 00:43:31+00:00,0,1,"That’s down from yesterday’s total of 224, and an apparent continuation of a downward trend that’s been at work since last week."
1288636302389215232,2020-07-30 00:43:30+00:00,0,1,"#SD29 #Coronavirus Update for Wednesday, July 29th: a total of 201 new confirmed cases of #COVID19 across the cities of California’s 29th Senate District. https://t.co/OjwULrkSmh"
1288584966557712384,2020-07-29 21:19:31+00:00,3,0,"Thanks as well to the nearly 50 people who made time to join our first ""Zoomin' with Newman"" virtual house party. Looking forward to the next one!

#BetterSenator #NewmanforSenate https://t.co/lt6oJuoDdS"
1288584958580162561,2020-07-29 21:19:29+00:00,6,2,A special thank you to @fjuhsd_scambray Trustee @JoanneFawley for joining me last evening to discuss the state of our respective races and provide her insight on how the #pandemic will be impacting our education system in California. https://t.co/xgAtxmvLAp
1288522323415293952,2020-07-29 17:10:36+00:00,0,0,"A recent report from the @BrookingsInst analyzed the impacts of the pandemic on LatinX communities and supporting a finding that state and federal governments should make support and relief for LatinX communities a major priority moving forward:

https://t.co/W99CGi9EZI"
1288522322723315712,2020-07-29 17:10:35+00:00,0,0,"Across the nation and closer to home, LatinX families and communities have been devastated by the pandemic, both with respect to their health and their economic prospects."
1288310032069562368,2020-07-29 03:07:01+00:00,0,0,"No definitive evidence of success has been proven for any of the vaccines thus far, but experts are ""cautiously optimistic"" based upon progress in the field to date.  More complete coverage in the @latimes here:

https://t.co/xiYpZlrZXA"
1288310030056304641,2020-07-29 03:07:01+00:00,0,0,The Moderna trial is one of four vaccines currently moving into advanced stages of development and trials.
1288310028269547520,2020-07-29 03:07:01+00:00,0,0,"A biotech firm called @moderna_tx announced on Monday that their vaccine candidate has entered a new stage, where up to 30,000 volunteers will be receiving a test vaccination to assess its efficacy and prospective side effects."
1288310027028058112,2020-07-29 03:07:00+00:00,0,0,"In the ongoing race toward the development of a vaccine against #COVID19, there are some encouraging signs of progress.  

https://t.co/xiYpZlrZXA"
1288267638796214272,2020-07-29 00:18:34+00:00,0,0,"Today’s totals also include 7 new deaths attributed to coronavirus infections: 5 in @City_of_Anaheim, and one each in the cities of @BuenaParkCA and @LaHabraCA."
1288267637370187776,2020-07-29 00:18:34+00:00,0,0,"That’s up from yesterday’s total of 134, but consistent with the numbers we’ve been seeing since the end of last week, which on average are substantially lower than what we had been seeing since the beginning of July with the start of the most recent surge."
1288267635063324672,2020-07-29 00:18:33+00:00,0,0,"#SD29 #Coronavirus Update for Tuesday, July 28th: a total of 224 new confirmed cases of #COVID19 across the cities of California’s 29th Senate District. https://t.co/yL88fXMt6z"
1288219440568442882,2020-07-28 21:07:03+00:00,0,0,"This is whom we'll be honoring with tomorrow ""Takeout.""  Please consider making a modest donation in support via the link below. 100% of your donation will go towards this effort and support those that have been there for us since the beginning. 

https://t.co/lgInmXSIrg"
1288219439708528640,2020-07-28 21:07:03+00:00,0,0,"The @NUHW, which represents them, is also deserving of credit for the work it has done in preparing their members for this fight, as well as for seeing to it that they are properly equipped and supported by hospital management."
